电影名,电影网址,导演,编剧,主演,评分,评分人数,评分额外信息,类型,制片国家/地区,语言,上映时间,时长,剧情简介,获奖情况,热门评论,海报链接,海报保存路径,剧照链接,剧照保存路径,视频链接,视频保存路径
悲情城市,https://movie.douban.com/subject/1294194/,侯孝贤,吴念真Nien-JenWu/朱天文,"['陈松勇', '李天禄', '高捷', '辛树芬', '陈淑芳']",8.9,70734,"好于96%历史片,好于96%剧情片",剧情/历史,中国台湾,闽南语/汉语普通话/日语/上海话/粤语,1989-10-21(中国台湾),157分钟,普通人的命运在轰轰烈烈的时代面前总是渺小到可以忽略不计。个人，如果勇敢地站出来想阻止时代洪流，多少像奋力扑向风车的唐吉坷德，往往只能当殉道者，而更多时候，个人甚至连选择当旁观者的权利也没有。可是普通人的悲剧，无疑能照出历史的荒谬与残忍。1945年日本无条件投降后台湾光复，基隆一户林姓人家眼见也要过上好日子，但人算不如天算，林家大小波折从此不断。“二•二八”事件发生后，家中的四兄弟更是只剩下老老实实开有一家照相馆的聋哑人老四林文清（梁朝伟）。然而悲剧并没到此终止，因为和进步人士有联系，林文清也没能逃脱被逮捕的命运，到此，林家男子只剩林文清和吴宽美（辛树芬）的幼儿——他尚呆在襁褓中咿呀咿呀地学语。,"['主竞赛单元 金狮奖', '联合国教科文组织奖', '金马奖 最佳剧情片(提名)']","['这片要是找个擅拍商业片的一定能拍出个厚重的史诗。侯孝贤在第一次不拍自己的时候却仍然坚持风格不变，戏剧性削弱、表演的削弱。在叙事上依然有意的断裂、留白，弱化故事的连贯性。不过度煽情，不强化冲突，甚至这么精彩的配乐都很少用，冷静的旁观。弱戏剧就意味着强化真实感，增加认同感。真是牛逼。', '如果谁想对台湾目前的状况有一个非常理性的认识的话,候孝贤的<悲情城市>是必看的.看之前我都没有想到台湾本省人和外省人之间居然会如此仇视,而且随着时间的推移,这种仇视已经慢慢转化为台湾人对大陆人的仇视.对这种情况,陈仪需要负最大的责任.其实日本人投降后,台湾本省人是抱着回归中国的积极态度的(影片中那些台湾知识分子动情高唱<流亡三部曲>就是一个例子),可是由于陈仪为首的大陆人在台湾的胡作非为,硬是把台湾人的地方意识给逼出来了,然后由于蒋介石的高压政策进一步恶化.', '（９／１０）很久以前给了这部片子差评，现在看来是我当时的阅历还达不到可以欣赏这部影片。可配合《芙蓉镇》一起看。观看前建议先了解国民党收台初期的缉烟事件和二二八事件，侯孝贤多少默认了观众知道这些历史背景。二二八事件处于旧秩序刚结束、新秩序建立前的混乱局面，总结起来就是兴亡百姓皆苦。台湾人受够了日本人的欺压，于是对中国人有过高的美好幻想，而这种幻想在国民党来临后旋即破灭。大陆军民带去的是歧视、贪污、腐败、打家劫舍……国民党抵台后没有安抚民心、反而一味指责台湾人“奴化”并大加排挤，本片中有句台词对此作了讽刺：“奴化是我们自己要的吗？当初清朝把我们卖掉时、有谁问过台湾人愿不愿意？”对台湾人来说只是刚忍受完日本人的歧视，然后忍受中国人的歧视。现在大陆很多人只嘴巴挂着统一，却依然有日本人和国民党的傲慢。', '总算看了一部让我相当稀饭的侯孝贤作品，要不然我要跟这位闷人皇帝诀别了。历史，政治，社会，文化，日本，中国，外省人，本省人，这些三言两语的已经没法概括了。我只有从深远与内蕴之后提取一个最肤浅的观后感：我觉得梁朝伟是华人里面最优秀的男演员。', '如果说杨德昌的<一一>是思想者的眼睛,那么候孝贤的<悲情城市>就是神明的目光.神者有二.一者冷静甚至冷酷.神终究为神,衣食无忧,生死无患,犹如看客般观望人世嬉笑怒骂,悲欢离合,却从不伸出上帝之手.二者慈悲为怀,菩萨心肠.候孝贤是两者兼有.', '侯孝贤的片，不是人人都能欣赏得了的~~', '想嫁一个文清一样的聋子 他说的每一句话 我都会相信 只有这样的人 每一个字都是用心听用心说的', '山河破碎风飘絮,身世浮沉雨打萍', '那时候的梁，年轻的让人震慑。看得我好难过。', '“我们本岛人最可怜，一下日本人，一下中国人，众人吃，众人骑，没人疼。”其实前殖民地的人们最没概念的往往就是“回归”，但“回归怀抱”永远是喊得最响的口号。风飘絮者山河破碎，雨打萍者身世浮沉，过得不好，政权更迭就都是狗屁。私以为侯孝贤善于化小但拙于见大，着小处侯更佳，揭大处更爱看杨。', '1989年，侯孝贤拍摄以台湾近代历史为背景的《悲情城市》，打破了当时台湾电影涉及政治的禁忌。梁朝伟在片中扮演不会说话的主人公文清，大获好评。二十三岁时，我是《悲情城市》里的中学教师，和同志一起对酒当歌，唱起祖国的歌曲。只有同我一样憧憬未来的青年，才能知我此刻心中的苦痛。——唱九一八的时候很触动人。', '张爱玲——路过台湾，浓蓝的海水上浮着青绿的岛，像中国山水画，那样的山，想不到，真的有！我站在那里一动不动，没敢走开一步，怕错过了，知道这辈子不会再看见更美的风景了。 悲情神思者，音响一何悲，清商随风发，中曲正徘徊，一弹再三叹，慷慨有余哀。四星给配乐', '侯孝贤有一种天生的悲悯，以林姓家族的悲剧命运昭示了台湾一个时代的惶惑和苦难。小人物在大时代的洪流中越发渺小，悲剧的命运不可避免，令人心酸。侯孝贤最好的一部电影，华语电影中的经典之作。S.E.N.S的原声瑰丽难忘。而年轻的梁朝伟，饰演男主，全片仅有3个字的台词，却依然能令人泪流满面', '歷史是甚麼。戀人絮語。少女日記。寒喧信箋。暗語出賣。血帕遺言。我們訴說歷史的話語如此輕碎，皆因歷史本身也破碎如是。', '""九份开始变冷了 芒花开了 满山白蒙蒙 像雪"" 寒冷侵袭的时候 谁又躲得掉。没有多复杂多华丽的铺垫 没有煽情没有矫揉造作的桥段 一帧一帧悲情的画面 放映出时代的绝情和平凡人的疾苦', '无声的悲凉', '史诗式的环境格局，平常人家喜怒哀乐背后微雕的恢宏悲悯，管中窥豹的细实风格，一切直迫人心', '台湾新电影巅峰，东方意蕴心理节奏，散文结构诗化风格，简化弱化戏剧冲突；222个镜头，长镜弱光，哑人执笔字幕叙事，日记旁白女声主线；二二八事件下的普通百姓，政治边缘人，城头变幻大王旗，跨时代史诗，家不幸之共鸣。不会国语的梁朝伟，息影末作的辛树芬，配乐无尽滋味。89金狮', '每个政权下都有自己的“二二八”，但无一例外地噤若寒蝉。有的人说了，他死了；有的人即便知道要死，也要说；有的人哪怕经历了，到死也不肯说。说即是回忆，回忆是对历史的尊重。可惜说与不说、记得与忘记，都不由我们掌控。叙述主体的压抑的喘息，构成了全部的悲情。', '侯孝贤由私人自传影片转向社会历史题材的代表作，获威尼斯金狮奖。1.以中远景固定长镜头泼墨出数十年无法风干的记忆,写不尽的家仇国恨和描不尽的乱世浮沉,沉静内敛下暗潮汹涌,悲怆凄美；2.神思者的悲沉配乐,余音绕梁；3.梁朝伟饰演的聋哑林文清，无言的控诉与无奈；4.空镜头,樱花盛极离枝。（9.5/10）', '从容有度，书之如画', '#剪辑#廖庆松：“我开始用一种唐诗的韵律来剪辑这部电影，用诗意的逻辑来拼接。我意识到，事实上有很多事情观众确实根本没必要知道，那些东西完全可以丢掉。对于场景的切换我故意用类似中国古诗过渡的方式来剪辑，前后运用同样的情感逻辑，使之得到统一。我还使用了大量的诗歌倒转法，场景的排列不以时间发生的先后作为顺序。我完全不去顾及传统的叙事逻辑。你完全没必要向观众解释所有的事情，主要整部电影是以同一种情感纽带和诗意逻辑来连接的，那就没问题了，观众会理解的。”摄影机没怎么移动，但由于特别的组合和连接，各个场景间萌生出一种诗意的节奏。', '少年时没看懂，如今再看，五味杂陈。侯孝贤，失敬了。', '个人与时代无法割舍而又纠缠不清的关系，林家四兄弟身上烙下了动乱、颠沛流离的时代印记。高级的悲情没有眼泪，亦没有歇斯底里，它在神思者原创音乐起来的缝隙里，在人物举手投足之间、在平实甚至平庸的生活角落中。侯孝贤将社会文本素材编排进自己的叙事语境，淹没在温吞、迟缓的节奏里。有苦难，也有困惑，更多的是悲悯以及人物的渺小，时代背景在导演的镜头下不过是画板底色，人物的行为无法点缀苍白的现实世界。悲而不凉，哀而不伤，我看到了努力生活的芸芸众生，只是无力左右自己，似浮萍、又似钟摆，演绎着一代人独有的彷徨。', '辛树芬，惊为天人', '侯孝贤的电影，没有煽情，没有高潮，就像是邀你坐在一旁看一家人、一座城怎样生活。悲情城市讲的是平凡的悲剧，发生时你还来不及懂，结束时你又来不及哭。一家一城一个时代，静静地，抽丝剥茧，看不到仓皇，却体会得到哀伤。因为语言，梁朝伟每次拍侯的戏几乎都告别台词，但这从来不妨碍你懂他、爱他', '侯的电影，总是很平，它不会直接深入要害，不会直接给你高潮，且一贯回避高潮。这与所有讲故事的电影恰恰背道而驰。侯的电影，像散文，而不像小说，散文中间断掉再看仍然很美，而小说中间断掉就很难再进入那故事，所以我说两次看悲情城市，两次都睡着，但两次睡起来都会大叫“真是好片”。', 'A+/ 回想起在九份的那个夜晚。走出老街之后，顿觉山路崎岖，海天荒凉。', '其实和林文清一样，电影也是听不清和说不出，但是却把台湾的一段历史都清楚明了地看在了眼里，像架设在生活之外的一架摄影机，没有涉入其中，而是完整地记录着生活，雕刻出了当代台湾的一张浮世绘。电影的镜头冷静克制，像一首抑扬有序的二胡曲子，令人积郁在胸，不禁悲从中来。', '无论我多么欣赏电影的整体，也无法阻止我讨厌大量长时间的空镜头！', '第二遍，大致看懂了。大时代下的人民是多么的渺小。', '台湾历史的失语症。若能开口，该讲什么语言呢？', '这种盲目沉溺在自怜中而不检讨前因后果的历史叙事，正是30年来台湾认同政治走向疯狂的滥觞。', '电影分析课老师在自习室放，因为我和另一位同学一边看一边点评、说笑，恁是把这部《悲情城市》看成了一部“喜剧”。有时间需要重温。', '像《恋恋风尘》的自我描述：相恋于乡间，分手于都市。侯的许多电影都伴随着乡间和都市徘徊，在这里，就好像是：理想生于都市，死于乡间。另一个主题便是死亡事件的设计，可能是像《童年往事》里的那些亲生经历太多。这样，将它们融入日常，这就是侯孝贤了。', '【A－】个人观看的第一部侯孝贤作品，感想十分复杂。首先，这片要是换其他风格的大导演来拍，那肯定就会变成像《教父》那样的家族史诗或是《活着》那样的民族史诗，但侯孝贤偏不。在电影里，他似乎在刻意动用着一切手段来抽离那些外显的人物命运与社会动荡所带来的戏剧张力，只剩下那些如云烟般飘忽不定的人心，等待着观众自己去捕捉。也许侯孝贤的风格一贯如此，那些观影途中的“沉闷无情”也能化为一种别样的“民族悲歌”。摄影尤为出彩，侯孝贤镜头下的群山、海岸、街道与祖屋都带着一股惆怅的情愫，身临其境般的孤独。以后若再重看，说不定会给五星。', '悲情城市注定是悲情的，但侯孝贤又是不甘于平铺直叙的。没有任何提示的闪回，没有任何铺垫的转折，所有这些都让人惊讶不解甚至烦躁，就像自己经历了一遍却于整个历史仍然无知一样。悲情城市注定是悲情的，但它又与侯孝贤先前的个人悲情完全不同。毋宁说是拷问，是沉重，是绝望，是孩子对母亲的爱与恨。', '老侯拍起这样沉重的历史题材依然不改他那碎片化叙事、淡化戏剧冲突、弱化故事高潮的风格，始终保持冷静的旁观姿态，所谓大音稀声，大悲无形就是这样了。', '朱天文语：事件来龙去脉像一条长河，不能件件从头说起，则抽刀断水，取一瓢饮……侯孝贤很快走进状态，丢开所有资料，素手空拳直接面对创制。P.S.读了《〈悲情城市〉十三问》才知，梁朝伟扮演的林文清之所以是哑巴，是因梁朝伟台语国语均烂，侯孝贤焦头烂额之际想到干脆让他变哑巴算了！', '真真正正拍出了深度，台湾人感触应该特别深刻吧。我似乎也能够理解为什么很多台湾人对大陆有深刻的仇视了。', '这么冷静的旁观镜头，却看得悲悯不已，太厉害了。很多大全景下的人物和冲突太贴合普通人在大时代背景下的渺小的这种表达。侯孝贤电影里的生活场景构建真是太真实。“你们要尊严的活，父亲无罪”这片子里的梁朝伟太让人喜欢。', '看之前实在难以想像这种史诗题材用侯孝贤的风格拍出来，但更难以想像如果不是他来拍要有多乏味。依然能看出恋恋风尘时期的影子，但也有了海上花的圆滑。无论洪流多么汹涌，生活总有一条苦涩的出路，所以一切都是平静。【卧槽其实我的内心独白是突然看了这么好的电影好激动啊。。', '节奏慢，但很值得细细品味，很好看！对白很美。“大时代下渺小的民众”（梁朝伟大赞！）', '确认华语电影的压卷，立意与境界之深广阔远无人能出其右。与长河式的史诗风格相暌违，侯孝贤采取的是一种创世纪式的全知写作，千头万绪的视线被汇集成辫，而这宽阔目光抵达的是反复唱叹的悲怆。单纯的讲述未曾稍减任何力度，反而是复调式的，如巴赫多声部的Cantata，此起彼伏的或惊惧或悲叹或狂喜的男女长歌“耶稣死了”、“有人背叛了他”……“呜呼五歌兮歌正长，魂招不来归故乡。”', '每一个时代每一座城市都承载着自己的恢宏与悲悯，不过分追求煽情，只细致缓慢讲述芸芸众生的喜怒哀乐和悲欢离合。侯孝贤是如此的从容不迫，梁朝伟和陈松勇奉献了最出色的演绎。', '《悲情城市》上映前，由于剧情涉及到台湾政治最敏感的“二二八事件”争议，直接挑战当时台湾社会的禁忌话 题，引发起各界人士瞩目。然而，影片先行参加意大利威尼斯影展并荣获最佳影片“金狮奖”的殊荣，成为首部在世界级三大 影展内荣获首奖的台湾电影，据信这是影片未遭禁演或删剪的理由。', '台湾二·二八事件七十周年将至，也许不遗忘历史的最好的方式就是重现历史。赛德克·巴莱如此，悲情城市亦如此。这是侯孝贤最具史诗气质的电影，呈现方式接近于牯岭街少年杀人事件。借一个家庭的遭遇反映整个社会的巨变，个人的命运淹没在时代的洪流之中。“生离祖国，死归祖国。死生天命，无想无念。”', '“我们本岛人最可怜，一下日本人，一下中国人，众人吃，众人骑，没人疼。”山河破碎风飘絮，身世浮沉雨打萍。侯孝贤平静揭疮疤，像把刀在我心里搅，出手无声，回手血狂流。不管从哪个角度来说，悲情城市是华语影史根本不可能翻越的一座大山。侯孝贤对于事实有一种深刻的洞察，这种洞察就如同时代的树影鸟，没有声嘶力竭的呐喊，安静自有千钧，大悲于无形。', '9.5 私人华语电影之首，境界之高，无人能及。侯孝贤把“二二八”事件前后的台湾拍成一个被故国遗弃的孤儿。人生不相见，动如参与商。今夕复何夕，共此灯烛光。——杜甫《赠卫八处士》', '不该觉得长镜头沉闷 历史不正是在这种沉闷的煎熬中一步步走来 汇集了多多少少家族和人们喜怒哀乐生老病死幸与不幸朽与不朽 想起沈从文说历史是一条河 时缓时急 有人一路顺水而下 有人赶上急流漩涡 跟着导演这些饱含自我认知期许的长镜头一路回望 时代那一声总结性的隔空叹息太鸡肋 唯有扒开了皮细看']","['https://img9.doubanio.com/view/photo/m/public/p2501579996.webp', 'https://img9.doubanio.com/view/photo/m/public/p2257400054.webp', 'https://img9.doubanio.com/view/photo/m/public/p2309045294.webp', 'https://img9.doubanio.com/view/photo/m/public/p2524056254.webp', 'https://img1.doubanio.com/view/photo/m/public/p478945688.webp']",./data/post_video/侯孝贤/悲情城市/image,"['https://img9.doubanio.com/view/photo/sqxs/public/p460135474.webp', 'https://img9.doubanio.com/view/photo/sqxs/public/p2215561555.webp', 'https://img2.doubanio.com/view/photo/sqxs/public/p2273826241.webp', 'https://img1.doubanio.com/view/photo/sqxs/public/p2550445967.webp', 'https://img3.doubanio.com/view/photo/sqxs/public/p1928913730.webp']",./data/post_video/侯孝贤/悲情城市/image,[],./data/post_video/侯孝贤/悲情城市/video
