电影名,电影网址,导演,编剧,主演,评分,评分人数,评分额外信息,类型,制片国家/地区,语言,上映时间,时长,剧情简介,获奖情况,热门评论,海报链接,海报保存路径,剧照链接,剧照保存路径,视频链接,视频保存路径
悬崖之上,https://movie.douban.com/subject/32493124/,张艺谋,全勇先/张艺谋,"['张译', '于和伟', '秦海璐', '朱亚文', '刘浩存']",7.6,665926,"好于79%悬疑片,好于58%剧情片",剧情/动作/悬疑,中国大陆/中国香港,汉语普通话/英语/俄语,2021-04-30(中国大陆),120分钟,上世纪三十年代，四位曾在苏联接受特训的共产党特工组成任务小队，回国执行代号为“乌特拉”的秘密行动。由于叛徒的出卖，他们从跳伞降落的第一刻起， 就已置身于敌人布下的罗网之中。同志能否脱身，任务能否完成，雪一直下，立于“悬崖之上”的行动小组面临严峻考验。,"['最佳故事片(提名)', '最佳男配角(提名)', '金鹿奖 最佳摄影']","['为什么张宪臣会因为找儿子被抓住，虽然他是特工，经过专业训练，但他毕竟不是超级英雄，本质上还是普通人。 只要是人，就会有七情六欲，就会有私心，更别说这个人还不是别人，而是他的亲生儿子。 为什么张宪臣越狱失败后不自杀，是因为他还有一个任务没完成——协助周乙诬陷金志德。 张宪臣上金志德的车不是偶然，是周乙对他说：上那辆白车。 而那辆白车，正是金志德的车。 对张宪臣进行电刑的时候，高科长看了周乙一眼，想看看周乙是什么反应。 周乙极力保持面无表情，直到高科长走向张宪臣后，他的眼睛才出现了泪光。 楚良服毒后，他那么努力地想要把毒药抠出来，身边的人以为他是想留活口，但只有他知道，楚良不是敌人，是同志。 楚良死后，他那句“妈的，晚了一步”是带了哭腔的。 高科长赶来后，他又变回面无表情了，就好像什么都没发生过一样。', '老谋子不愧“华语电影色彩学”领军人物，衫乌，雪白，血红，几种颜色，一个世界，被大雪覆盖着的黎明，好珍贵。这又是非常不张艺谋的电影，不浓烈，不奔放，满满的克制隐忍，反而成就了电影气质。70岁了，还是那个让人刮目相看的张艺谋。', '约莫是老谋子近五年最稳定的一次发挥，也大概率是今年五一档最能看的一部。拍得艰难（冰天冻地，剧组又经历两次隔离），但我却没能从他摄影机不停的紧迫感里看出真正的表达欲：相比《一秒钟》有意反抗的初心，《悬崖之上》显得没那么必要，纯粹是秀一把工匠手艺，没野心探索谍战片的新路子。 节奏把控是到位的，文本的悬疑感、紧张感从始至终立住了；但群像的塑造真不如《风声》，都太像创作者的棋子：过于强调行动，没留太多空间深挖人物内心，可动作戏的视听和调度也稍平了些。刘浩存真像一株无辜的水芹，泪眼盈盈却空洞干瘪，实在看不到她作为演员的潜力。 无论如何，一位年过七十的大导演，仍在跳出舒适圈、尝试不同类型，学黑泽明谦卑地说“我还在学习拍电影”；反观一些青年导演，一看豆瓣评分低，就骂这届观众不行，对比之下是不是太过惨烈？', '3.5 是好看的，全程紧张，但不太经得起回想深究，无论是剧本（悬念段落的粗暴堆砌和段落之间的不连贯不严谨）还是调度（无论是追车戏、街头枪战还是密闭小空间的动作戏，拍得都很敷衍过场，有一场戏甚至缺失了重要的角色反应镜头），收尾应该更利索点，表演都很好。', '为了完成任务，在哪里跳车，朝哪里呕吐都很重要。告诉小兰要抱有同志已死的觉悟，终究难以放弃孩子犹生的幻觉。读过伊索寓言便知道，欺骗是立身的母本，谎言是求生的记号，鬣狗与狐狸谁都难以在乱世里幸存。无法从楚良口中掏出的药片，如果成分是剧毒，那毒的名字叫甘愿。抱有幻觉必死，心向黎明永生。', '节奏好奇怪，重点不应该是乌特拉计划怎么完成的吗，前面做了那么多牺牲，为什么小兰和老周在电影院碰了个头，镜头再一转任务就成功了？书店那一遭属实有点超能力，人从书架前过了一圈书就没了。于和伟演得真好，张译和秦海璐也很好，朱亚文和刘浩存有点拉，老金好倒霉。', '节假日去影院真是种折磨：后排的中年夫妻全程大声解说剧情；右边的中年女人每声枪响都要大叫一声“哎妈呀”；前排的小孩从关灯就大喊着要出去玩，一直喊到张译受刑变成了尖叫。周围人劝妈妈把孩子抱出去吧，他妈妈说要出去你自己出去......于和伟被铐时孩子开始嚎啕大哭，哭了十几分钟，黑暗中终于响起了最悦耳、最有磁性的吼声：“滚出去，别在这嚎！”妈妈终于抱孩子离场了......我他妈简直想冲上去跪舔这位男神！亮灯后我到处搜寻这位伟大的身影可惜找不到了，男神！我爱你！！！p.s. 电影很好看，悬念迭起节奏紧张，摄影剪辑很稳，五一最佳', '不如《一秒钟》，老谋子又犯了“画面音效演员啥啥都绝了但就是故事不行”的老毛病，所以各位导演能别插手编剧的活儿了吗？整部片子拍得虎头蛇尾，没有一个观众在结束时不发出“就这？”的声音，一部悬疑谍战片逻辑bug多且明显就毁了一大半了，基本是靠老戏骨们的演技撑着。另，能不能别再强捧刘浩存了，也太出戏了', '他肯定知道枪被做了手脚，因为被搜出来的时候他是清醒的，所以他最后才对着周乙假装开枪，这样可以减轻周乙的嫌疑。', '“朝闻游子唱离歌，昨夜微霜初渡河。”12年后，《风声》之后国产谍战片的下一棒，《悬崖之上》接住了。', '最大的bug是小兰在车站开枪杀了一个警察后没有被发现', '7.5分。工整、好看。但问题还是那个老问题：这种由一拨会演戏的演员主演、剧本能把故事讲称头、剪摄服化道各方面都到位的电影本应该是中国院线电影的基本水准线，可为什么它成了张艺谋级别的导演才能拍出来的？它不应该是一个崭露头角的青年导演拍出来的吗？反过来看，张艺谋级别的导演还拍这样的行活商业电影有什么意义呢？对电影史尺度上的艺术性或者思想性有任何贡献吗？当然了，张艺谋想拍什么电影都是他的自由（虽然他事实上并不自由），我不是在质问他，我问的是中国电影出了什么问题。【JSZ万达】', '也就是个行活，感觉拍的不是很认真。', '剧本太粗糙，大量的漏洞和虚假，用演员来遮情节，甚至存在数次过火且不合时宜的幽默过度，氛围是暂时的调节了，但却将整部电影的情绪推向了纠结分裂的状态。武戏碍于故事背景的厚衣，在观赏性与动作设计上的确存在难度，韩国武指的表现也只能说是差强人意，过快过轻，不够沉重，大概只有开场和沙溢西部片式的对决感觉是最对的。种种细节弊端因张艺谋的种种特写而暴露，并非他拿手的不适合类型，而是缺乏进一步的思考，以至于让本来可以规避的问题因快节奏的悬疑与动作需要而被忽视。其实参照系应该是梅尔维尔的《影子部队》，包括那栋安全屋所代表的某种衰悲与隐秘，人物的阴冷雕塑感，于和伟的表演也有往那个方向倾斜的意思，虽天然受限只能点到为止，但“周乙”这个角色身上背负的复杂和多元，成为电影最好的创造，一路拼杀谋划，却仍不知归宿在何处。', '小兰车站开枪都没人听见真的说不过去啦！', '风声之后又一部好看的谍战片。 画面运镜一流，漫天飞雪的东北大地，暗流涌动，火车上邻座可能就是敌人，哈尔滨化身特工之城，没人知道身边是敌是友。即使在这样恶劣的环境下，我们的先辈仍然能不屈不坚守信念挠，以特有的方式传递信息执行任务，即使牺牲前也将最后一颗子弹留给自己，令人感动和敬佩。 演员演技都很好，最喜欢于和伟的表演，隐忍又克制，以微表情致胜。 国师镜头下的谍战冷静又克制，同时又有大量留白给人思考。影片一开始就基本交代了敌友关系，没有太多的悬念，更多的是探究人物人性本身。但是张译被捕那场戏感觉有点断层，不知道是不是删减了。而且喜剧元素过多，把紧张的氛围破坏掉了，不太喜欢这样。 当然整体还是一部好看的国产片。“我们能等到天亮吗？”刘浩存最后的发问让人泪目。感谢先辈们的奉献，换来如今幸福的生活。', '张宪臣因为牵挂在马迭尔饭店门口讨饭的孩子被抓，父子匆匆一面。无论什么样的训练，人因为情感而不能精确，这是真诚、仁慈、坦率的。', '好看，各个方面都很好。没想到张艺谋还能拍悬疑片，老头不老。唯一的缺点，剧情转场有些生硬，感觉被删减过！', '就，看完有种不得劲的感觉，但是你又说不出哪里不对劲。就你不能说它多不好，但它就是差点味儿。仔细咂摸半天，就感觉是朱自清非得学东野圭吾写小说的感觉。 张艺谋的电影情感细腻，比较适合简单的故事，比如《一秒钟》《秋菊》等，故事没什么跌宕的情节，换别人可能拍得索然无味，但他可以用细腻的情感填满故事。如果故事本就跌宕起伏，就反而拍得不伦不类，结果两头都不占好。 而且剧情从一开始就没有逻辑，怎么可能派两对情侣去执行重要任务？？组织没有脑子的吗？？只有开头密码纸与主线任务相关，中间全是怀疑，查内鬼，你救我我救你，谁也没救出来，最后交代一下，一直下线的小兰和其他同志完成了任务。感觉看了个寂寞。 老张被捕的那段我目不转睛地看也没看出来特务们是怎么锁定目标的，分明前面完全没有破绽，从巷口出来突然就开始了追逐战。', '跟“风声”走不同路子的谍战片。国师的电影总是意境强于故事，以致于看完只记得漫天飘飞永不止歇的雪花。只要熟悉近现代史就该知道，国破之后便是家亡——这可能是我此生都无法做恨国党的原因吧...', '只见气氛，不见故事', '就一帮演员，玩起红色题材剧本杀，置起码的逻辑于不顾。如果可以选择，真愿意看他们去为一点儿女私情搏命，而不是在演胜负已定的戏中戏。有些桥段，非常之《兰心大剧院》——也特别遗憾娄烨电影遭遇那样的结局。', '先说结论，非常惊喜。老实本分地完成这种类型故事该有的样子，不耍花，不耍滑。《悬崖》的剧版已经非常优秀，相比于那个故事在整条时间线上保持紧绷，这个电影版就是只在一个截面的刀刃上起舞。这种已经非常成熟的本格谍战看的其实是演技、氛围、服化道美术等等所有细节的扎实程度，这部电影都做得非常到位。已经很久没看到这么好的群戏，除了刘浩存有点跳戏之外，每个演员的举手投足和一笑一颦都有得品咂，尤其于和伟太令人赞叹。当然，有些地方的剪辑回溯显得急躁，可能是囿于篇幅。张艺谋是中国导演中被误解最深的一个，人们希望他是大师，隐士，艺术家和叛逆者，但他自己看起来却极其不爱惜羽毛，其实他很清醒，每件事想要什么，会失去什么都明明白白。他所有片子都在探索一个想要的面向，直到现在还是这样，从这个角度去看，就比陈凯歌好得太多。', '讲真，张艺谋拍商业类型片还是拿手的，从镜头语言到表演调教，没得说，继续高产吧！', '中间还是挺有谍战紧张感的，开头第一人称眩晕视角放三次是要咋地？结尾也过于追求HE了，一个潜伏要员，就这么明目张胆去帮忙做任务，接孩子，杀叛徒？这河狸吗？你可是高级特务啊喂！其他人物也不太经得起推敲，这么重要的任务派两对情侣来？理由是这样你们就不会出卖对方了？张译有两次死的机会一次都没抓住，尤其第二次都做好觉悟了，还是被逮了回去逼供出了情报，这就强行推进剧情呗？楚良也是妥妥的工具人，一路跟个憨批一样，受过那么久的训练完全沉不住气看见女朋友被叫走当场自曝身份，唯一的作用是最后通过一系列巧合帮周乙洗白。特务处内部业务看起来也是漏洞百出，抓卧底这条推理线实在太弱了，简直是小学生作文水平，看周乙跟处长狡辩我脚趾快要抠出三室一厅了。看的时候还是不错的，就不能细想，一想就觉得尿点实在太多了……', '编剧给朱亚文安排的这个角色是在干什么？！跑东北来谈恋爱吗？前半段差点儿没把对象送走，后半段直接把自己送走。编剧给张译安排的角色又在干什么？！伪装得混过敌人的眼睛然后莫名其妙被车撞。', '这电影挺好，只是不太适合上了一天班，明天还要加班的人。不是因为剧情有多复杂——其实并不很烧脑——主要是电影当中许多魅力都凝聚于细节上，需要观众细心看，慢慢品。如果一边玩着手机一边看这部电影，虽然囫囵吞枣也能看个明白，但是魅力就会削减许多。 影片节奏并不拖沓，打从一开始就单刀直入的进入主题。但寻常的电影节奏有高有低，有紧凑有缓慢，而这部电影的节奏一直处于同一高调。加上文戏居多，且全程冷峻，没有大起大伏的情感波动，以至于喜欢快节奏的观众可能开始挺满意，但时间一久便不太能感受到节奏的变化；但如果观众精神好或者耐心好的话还是能从许多细节当中品悟到滋味的。像《归来》一样，不看手表根本不知道电影进度如何。', '2.5；与其对标《风声》，不如参考《潜伏》，群像人物的丰富演绎空间与人物关系交错的潜文本压缩在两小时内，只能顾头不顾脚——前半段细致紧凑的细节呈现，到后半程寥寥几笔交代，以及中间重大环节的衔接，观感是跳跃甚至断裂的，真的更适合拍成剧。因此，作为谍战戏最重要的悬疑氛围是缺失的，这一点坐我后排的观众可充分说明——全程现场音轨评论，提前“剧透”几乎猜中百分百，每一个戏剧冲突、每一次最后一分钟营救，都在观众意料之内，更遑论所期待的阴郁惊悚感，甚至悲壮感都被穿插的情感戏份稀释。 动作戏/飙车戏并非张艺谋所长，只能说表现平平；演员自然是好的，余皑磊演这类人物成精了！最后求求国师能不能别这么偏爱刘浩存？', '我党深知职场PUA对于业务成败的重要性，老周成功的利用这一点搞掉了同事老金，望见了黎明。', '电视剧水准 毫无诚意之作', '张艺谋是一个很好的“职业导演”，什么题材都可以拍，不管什么题材到了他的手上，都可以在美学上达到他的极致。《悬崖之上》就是一个完成度很高的行活，导演在视听技巧上没什么野心，视听技巧层面上跟奉俊昊黑泽清他们比，根本不是一种东西，就是干了一个商业片行活，但摄影上还是一如既往的极致，剧本和表演相辅相成，互相成全，整个戏的节奏感非常好，娱乐性很高。', '和一秒钟一样，充满了像是没拍完的感觉。男性角色隐忍，女性角色流泪过多，有点脸谱化。张导太爱刘浩存了，爱到刻意加戏，几乎免去了高难度戏，只剩镜头前静秋式小白花哭泣。', '角色的角力关系与《一秒钟》并无二致，但特定环境下产生的情感冗余被拿掉，只在呈现高强度的剧力，张艺谋电影的“动作感”通常也与剧力胶着。定位与伊斯特伍德变得相似。', '于和伟和倪大红把这部戏的评分拉满了。', '简直是侮辱人智商。一星都不想给。', '冷峻克制，表演工整，剧情还是差了点，张译怎么突然就疯癫下车找孩子了呢，小姑娘怎么就跛着脚逃出火车站了呢，任务怎么就瞬间完成了呢，太神', '片长承载不了密集的内容体量，很多条线都在忽而休止，不留一点缓冲。人物设计不是太满就是太空，一个片子同时塑造近十个主要人物，居然没有一个能让你留下立体丰满的印象，每个人都是一张写着聪明或者愚蠢、正派或是反派的纸。 多说一句题外话，张译，你被活着抓走到底图什么？', '张艺谋对谍战片的首次尝试，还是值得鼓励，只可惜剧本漏洞不少，没法称得上这一类型片中的优作。摄影精良，对空间的运用也可圈可点，尤其是火车车厢内的试探、智取与肉搏戏。大雪纷飞、严寒凄冷的哈尔滨，再点缀上夜晚的霓虹招牌，凛冽与阴暗的氛围十分契合于特工行动险中求胜的艰辛酷烈。演员发挥基本都值得赞赏，特别是于和伟，将沉着机智与隐忍伤怀都诠释得无懈可击。缺点也十分明显：剧情发展跳脱断裂，不少情节与细节不合逻辑，孩子这条线很生硬，强行拽动故事走向，四人间的隐秘情感与过往前史并未有足够铺陈，到最后也难以让人真正共情。收尾仓促缺乏高潮（且并不适合用所谓“麦高芬”或反高潮来辩护）。电影院场景没有足够价值和意义，未用好其空间，有点单纯为了迷影致敬而贴上的感觉。刘浩存虽然美，但还是不适合演谍战片。（7.0/10）', '惊喜！有北野武《极恶非道》的味道，动作戏呈现撕咬感，毫无宣教意味，意识形态的绳索亦被解绑。省去无用的语言，余下的一是陷阱，二是遗书；分镜如此爽利，眼神里包含所有，每一次剪辑都在传递暗号。行动线的链条被反复敲碎，情节的推进与处心积虑的悬念无关，皆为一念之间。令人惊喜的还有不凡的女性形象，秦海璐和刘浩存的重头戏压过男演员。还是很感动，因为你能在这部电影中看到张艺谋的脑力、体力、判断力，更难得的是战斗力。', '张艺谋在大陆拍商业片已经独一档了，有那么几个瞬间我仿佛感受到了好莱坞般的电影工业水准。而且真正意义上头一次在大陆纯商业电影里看到正反派势力均衡地投入人数相当的演技派互相飙戏，坐在IMAX厅里那种沉浸感简直一本满足！', '剧本已经是蜻蜓点水云里雾里落点无内容了，糟糕的分镜和空间呈现却也这么让人难受根本不知道该怪艺谋还是小丁丁，糟糕的剪辑执行更让它整个烂掉，这开头10分钟能看吗？那大航拍落地还一蹭也太丑了吧B站UP主级别。至于空间，连正反打的光都是不接的，一秒钟以来就都有这个问题，毫无剪辑逻辑、空间意识。', '作为谍战片，也太糟糕了。作为献礼片，也太粗糙了。故事的前提、逻辑、剪辑、细节无一处经得起推敲。', '什么破玩意儿，拿这个致敬？？？', '张导扑街之作，你说是大鹏拍的我都信。果然赶时间张导也得凑合', '有时候我就怀疑这是不是张艺谋拍的电影。在苏联受过特训的特工在方方面面都能露出马脚，火车上刘浩存一下就露馅了被敌人检查，离谱的是检查室只有一个人，打架动静这么大没人听见。厕所接暗号动作是真反常的快，有人有异常举动不去怀疑。书店全城可能就一家，七八双眼睛盯不住那么明显位置的书，那个女特务重要场景都能在场，然而啥也发现不了。要是没有周乙这个内部人员，整个局早就死了。反派智商捉急，去掉手枪撞针，难道一个特工一顿饭功夫睡过去，醒了不检查自己身上的东西吗？明显是要手枪发挥作用。刘浩存始终演的不像特工，像不食人间烟火的学生，执行任务感情泛滥，却活到最后。', '王郁在卫生间咬牙忍住不哭出声的时候我也攥紧了拳头', '几乎所有的冲突和高潮都是片段性的，这根本就是一个压缩后的电视剧剧本。张艺谋到底干了啥，拍雪吗？', '简而言之，除了全片大雪纷飞的哈尔滨气氛对了，其他什么什么都不对。我个人很烦用一惊一乍铺得满满当当的音轨来强行制造紧张气氛的，坐在IMAX厅里听着没完没了的哐哐哐我真的很想打人。这追车戏把我看傻了，多久没在商业电影里看到这么稀碎的追车戏了。到结尾我满脸惊诧就写着两个字：就这？年轻演员演技青涩可以理解，但连着三部戏我是完全看不出刘浩存这个孩子有什么未来可期，既没有技巧性也没有灵性。', '6.0分。这部电影的好，和《八佰》类似，它有一种可以称之为“窃取自真实的力量”，它聚焦在了特工们的信念感，它提醒了我这些历史英雄的真实存在。然而，它存在三重遗憾。第一重，它表现了在肉体刑虐上的奇观，没有给予我如《风声》那般叫人难忘的，从生理到心理的痛感。没有痛感，那些地下英雄舍生忘死的自我牺牲就失去了韧性和重量，显得易碎且轻飘。第二重，同样是在拍哈尔滨，拍冰天雪地的冷，相较于《白日焰火》，《悬崖之上》只停留在了视觉上的冷，没有冷进观众心里，张艺谋没能像刁亦男那样给予我从心理蔓延到生理的冰冷刺骨。这一点直接折损了本片的影像魅力。第三重，它在叙事上的孱弱，有佳句，无佳章。尤其是在严肃的情节之中，出现了不合时宜的幽默就成了滑稽，于和伟、余皑磊与于和伟、倪大红的两场对手戏如是，这是剧力的崩溃。', '太会讲故事了 原来谍战片也能拍出诗意 漫天的大雪与血色的英雄 在破碎山河上谱写一曲曲悲壮的恋歌']","['https://img2.doubanio.com/view/photo/m/public/p2641614433.webp', 'https://img1.doubanio.com/view/photo/m/public/p2636487059.webp', 'https://img1.doubanio.com/view/photo/m/public/p2640044329.webp', 'https://img1.doubanio.com/view/photo/m/public/p2641226257.webp', 'https://img3.doubanio.com/view/photo/m/public/p2643244560.webp']",./data/post_video/张艺谋/悬崖之上/image,"['https://img2.doubanio.com/view/photo/sqxs/public/p2640318171.webp', 'https://img2.doubanio.com/view/photo/sqxs/public/p2617084123.webp', 'https://img2.doubanio.com/view/photo/sqxs/public/p2640318853.webp', 'https://img3.doubanio.com/view/photo/sqxs/public/p2640318850.webp', 'https://img9.doubanio.com/view/photo/sqxs/public/p2640318855.webp']",./data/post_video/张艺谋/悬崖之上/image,"['https://vt1.doubanio.com/202204201907/86028f6fe130799a3ae01500a0ca51cd/view/movie/M/402740957.mp4', 'https://vt1.doubanio.com/202204201908/f3bf88c318fabfc5376651832e9d9ddd/view/movie/M/402740419.mp4', 'https://vt1.doubanio.com/202204201908/23f1ea90e86daea55c5244b230851988/view/movie/M/402730843.mp4', 'https://vt1.doubanio.com/202204201908/404aa5fc2d08f0ee926b96fbfd883d95/view/movie/M/402730513.mp4', 'https://vt1.doubanio.com/202204201908/8648e3a2006c7fc942660348935dd782/view/movie/M/402640343.mp4']",./data/post_video/张艺谋/悬崖之上/video
