电影名,电影网址,导演,编剧,主演,评分,评分人数,评分额外信息,类型,制片国家/地区,语言,上映时间,时长,剧情简介,获奖情况,热门评论,海报链接,海报保存路径,剧照链接,剧照保存路径,视频链接,视频保存路径
女人，四十,https://movie.douban.com/subject/1308162/,许鞍华,陈文强,"['萧芳芳', '乔宏', '罗家英', '罗冠兰', '丁子峻']",8.9,41480,"好于97%家庭片,好于96%剧情片",剧情/家庭,中国香港,汉语普通话/粤语,1995-05-04(中国香港),101分钟,家住旧楼、性情火爆的孙太阿娥（萧芳芳）每日奔走于家庭、公司之间，为家人、公司处处精打细算。她家中有做驾证考官的丈夫（罗家英）、正念大学的儿子（丁子峻）、待她若亲生女儿的婆婆及军人出身的臭脾气专横公公（乔宏）。丈夫弟妹一个住在富人区，一个远嫁台湾，平日与他们疏于联络。婆婆的突然病逝令公公变作痴呆老人，他脑里只有旧事若干、眼前只识阿娥一人，所做的荒唐事一件接连一件，阿娥一家疲于应对，在家安心做主妇的弟媳又不愿伸手相帮。阿娥与丈夫试过送公公去日间老人看护所、老人院，却一样不能省心。而给阿娥带来诸多乐趣的工作也因碰上年纪轻她、能力强她的对手令她烦心。但公公亦用自己的方式对人到40日渐有心无力的阿娥表示着感激。,"['金熊奖 最佳影片(提名)', '金马奖 最佳剧情片', '最佳电影']","['休涕泪，莫愁烦，人生如朝露...', '李安的生活总是柳暗花明与愈发透彻，杨德昌的生活总是无可出逃与一直疲惫，许鞍华的生活就是生活，没有出离心也没有歌颂心，得过而不且过。', '有妈当如萧芳芳。腹黑不过许鞍华，千言万语化做血染的风采；小车司机拍着车门大骂：死老头，找死也不要害别人！你以为你是坦克车么？！快闪一边去！等死吗？再不走开就撞死你！！！', '你知道人生是怎么一回事吗？人生，是很过瘾的', '喜爱许鞍华，就无法绕过极为经典的两部电影，一部是《千万言语》，一部是《女人四十》。《女人四十》围绕一个四十岁主妇的日常生活展开，娓娓讲述着人生细碎的无奈与亲情的聚合悲欢，没有太过煽情的场面，亦没有大起大落的剧情，却在一言一语，一饭一食的日子里，一点一滴道尽了四十岁女人的隐忍坚强，', '片子里的老人去世前说：“你知道人生是怎么样的吗？很有趣的。“可能人生正如这部电影一样，在一个个质朴的镜头中不动声色地流淌，既有温情，也有无奈。看了《女人四十》、《天水围的日与夜》、麦兜系列、《香港有个好莱坞》，我越来越觉得香港都市平民中蕴藏着一种独特的精神，孕育了这些特殊的电影。', '这种片子就可以称为神品', '法国导演特吕弗说过：蹩脚电影之所以充斥着血腥暴力，是因为导演没能力通过朴素而简单的镜头表现强烈的感情。这，恰好是后者。', '从开场的等鱼死到最后的人生如朝露，电影说的是女人四十，其实讲的还是一个“死”字。人被时间岁月所打败，衰老和失忆被表现得极其可怕，养老院寥寥几幕还有年轻人说的大实话，它们都道出了人生的残酷。面对五十年不变的诺言，它或许是小孩子的勾勾手指尾，又是片中那对相扶相渡的模范中（老）年夫妻', '重看《女人四十》，真好。人生這麼苦，卻能苦中作樂，活在當下，是一種動人的生命力。蕭芳芳演得好，她提議了把魚拍死和「落雪」兩場戲，兩幕戲皆成為了經典，證明她不但有好演技，也有創作力，是足以代表香港最高水準的女演員。', '中年妇女与痴呆老年的故事。严重影响一群人的结婚观，看完此片的女性，你还敢结婚吗？你在结婚前是否会在意男方家庭还上有老？如果你很坚强，如果你有勇气，那么你就结婚吧。影片中的细腻与现实，真让人感到压抑，但是许鞍华却又可以让人在压抑中会心一笑，实乃一部佳片！', '萧芳芳那句“以后多些时间在一起”真是道尽了人生辛酸。“你知道人生是怎么一回事吗？人生是很过瘾的…”', '女主的名字和我妈一样，情况也类似，我要更体谅她。', '乔宏是空军队长，只有失忆时才会用北方话指挥机队。他为何来到香港呢？步出老人院时，老人把落花当作飘雪。自离开北方后，应该有几十年未见过雪了吧。许鞍华的香港电影里，其实总有战后第一代移民知识分子的大陆视野，隐而不发的家国情怀。', '我的青春小鸟一去不回来。', '匆匆促促的琐碎与骀荡，逼仄人生中的轻倩闪光。许鞍华真是仁慈，再破败的生活也会拍出几抹亮色，活下去毕竟总还是有希望的。真的，不管多苦闷心烦，嘴上抱怨几句也就算了，心里一定要有无限温柔，才可以撑过人生的广袤荒芜。', '这活生生的我妈，估计我要在许鞍华电影里找到全家了', '《虎度门》也是如此，萧芳芳真是一个好演员啊，唱戏出身让她总有一身英气。生活的琐碎，女人四十的种种。当然少不了老乔宏。', '笑得比难过的地方多很多。但是就真的很难过。看吧，其实鸽子飞回来了。', '从细部到整体都感觉很好很好的一部电影（如果一定要挑毛病那么后半段稍微差点但结尾又很好啊）。萧芳芳也太像我妈了，晕', '青春小鸟在飞，老伞兵在飞，summer snow在飞，鸽子在飞，可女人四十该怎么飞？结尾一张呆照直通特吕弗《四百击》，许鞍华试图用奢侈的几秒钟留住哀乐中年之美，画外却是“人生如朝露”，静动之间，丰富的女性况味。', '在对的时间遇到了一部对的电影。许鞍华无疑是一位大师，她的功力是化骨绵掌，于无形处影响你。英文名Summer Snow，夏雪，那意境就和四十岁的女人一样美。然而片子又和年龄段无必然关系，因为这就是生活最真实的样子。萧芳芳的戏太好了，整部片子笑中带泪，天呐，怎么会这么好看。', '片尾曲尤佳，严肃又荒诞的调子，再应景不过。教室后排，泪贯满盈，感怀不止。', '#重看#四星半；很重也很轻的人生，以及很过瘾的人生；四十不惑，不惑是不惑了，但上老下小的重担，压在职业女性肩上，如何分配精力怎么经营事业家庭兼顾，20年后的今天依然无法解决；生老病死柴米油盐，是达观，也是知命；演技无痕，宛如日常流淌，欢笑和啼哭，都缝在时间的针脚里。', '萧芳芳将中年女性的隐忍，坚韧，对家人的责任感，爱和付出表达的淋漓尽致！', '质朴而暖心，笔触之细腻甚至超过了13年后的[天水围的日与夜]。对老年痴呆的公公的描写在喜剧色彩与酸怅悲凉感间达到了完美平衡。萧芳芳的柏林影后实至名归。“休涕泪，莫愁烦，人生如朝露”“生活是有趣的”。一树落英缤纷如雪，遂有英文名Summer Snow。由等鱼死始，以白鸽降临吃食终。（8.5/10）', '说实在的，从我这个男人的角度来说的话，这部片子实在是无聊透顶，没什么意思，就是一个中年妇女的生活琐事，太无聊了，估计女人更能感同身受吧。 所以这部片子还是拍给女人看的。 我很喜欢 许鞍华的 男人四十， 这可能就是最大的不同吧。', '许鞍华的家庭伦理大戏，萧芳芳和乔宏平分秋色，彰显女性导演的细腻温婉。当然不仅仅是刻画女性身份，更多是对家庭这一单位内部情理延伸至外部伦理的整体统一。许鞍华对现实的加工和处理，是属于体验派的风格，把生活真实再现在你面前，且充满温度和力量。', '小市民艰难又有乐趣的生活。', '许鞍华对家庭的见解和洞悉不比是枝裕和差，这部相当于香港版的《东京物语》。也因为如此在之后从许鞍华家庭细腻中看到了无数电影的影子，《桃姐》和《天水围的日与夜》等等的影子。家庭和职业生涯和各位""女性""的说法没有答案，生活琐碎和当下的幡然醒悟就是答案。许鞍华拍出了一部超越时间永不过时的作品，也是最好的作品。', '雨天就应该看港片呀。许导片子里的女人都是一个气质的，萧芳芳也是一个很适合许导片子的女演员。医生跟孙太说，你爸爸得的是老年痴呆症，治不好的，只要你好好照顾他，就不会恶化。生活其实就像是患了老年痴呆症一样的，你好好照顾他，他才不会恶化，并且你也才能体会到其中的乐趣。', '我不知道這個一輩子對女性毫無尊重的男人為何老年值得享受兒媳的細心照料，這樣的女性值得稱讚但絕不值得鼓勵。女性的形象應當是多元的，而不應該以這樣一種忍氣吞聲任勞任怨一輩子的賢妻良母形象為“經典”。從此角度上來看，許鞍華的確不是一個女權導演。', '认为夏雪是一个现实向超现实转化的信号。前半部分的刻画极度真实，尤其是我小时候亲眼看过外公外婆怎么照顾老年痴呆的曾祖母。但夏雪后发生的事就理想主义起来了，比如在公司需要自己的时候辞职，接爷爷回家并以他为中心生活，最后爷爷想象中的鸽子的出现是不是要告诉我们这中间发生的一切是不切实际的', '50年不变？—他妈的这就是一句谎言，诸位女同胞别信啊！！！（1997+50=2020）', '单独看《女人四十》是一部侧重女性的电影，拿来和《男人四十》比对，又有不同的奥义。上有老下有小的中年女性，柴米油盐的小事和生老病死的大事都要面临，连打一把麻将的时间都没有，人生完全交给家庭还有工作，金钱和精力也都耗费在自己以外的人和事身上。对这个阶级和这个年纪的女性形象刻画得还是很贴近真实。只是个人认为很多生活日常拍得未免过于琐碎庸常了。', '许鞍华执导。1995年的「女人四十」和2002年的「男人四十」，听起来像是商业片的组合拳，其实却细腻得不得了。得了老年痴呆症的爷爷曾经是空军中队长，性格软弱的爸爸不忍心将父亲送去敬老院和刻薄的二弟家，生性善良体贴的妈妈从一个工作女强人慢慢向家庭转变，远嫁台湾的小姑姑已经不复当年青春少艾但得到爷爷赠送的花朵依然开心不已，儿子在健全的家庭中成长也学会了如何跟女友坦诚相见。整部电影的角色都很善良，但却一点都不觉得善良得刻意，一切都刚刚好。就像性格温和的邻居霞姨已经年迈 但一直在坚持照顾老人痴呆症的丈夫日常起居，她对萧芳芳说：「你知道人生是怎么一回事吗？人生，是很过瘾的。」', '老人癡呆症~已經普遍存在,家中有老人的都非常有機會遇上這個棘手問題.要如何去照顧,身為現代的你我都要學學.實話說~蕭芳芳的演技真不是吹的.雖然片子有點讓人不知所措的累了,還是值得一看.', '萧芳芳的代表作，许鞍华丧失才华前的颠峰之作。非常的好看，一扑儿一个笑点，但这笑点之后是心酸/感动/揪心/温柔，种种种种，十分难言，非常爱看。', '一部好片。但还是要排在小津和伊丹之后的。喜剧性一方面在消解悲剧性，这是想要的；副作用是消解了人性，为了情节变得有些失真。剪辑节制，布光神。没听到粤语原声是一大遗憾。', '用细节堆起来的电影，人的互动非常动人。虽然真残酷，低清镜头里的生活如此惨淡，被琐屑充满，被生老病死框住，但总有幽默的亮色，有勾勾手就定下来的一生，有summer snow和郊外的野花。人生如朝露，女人四十却不能以杜康解愁。但小小生命里有大智慧，教她把鱼头和鱼尾拼在一起，就像什么也没有失去过', '“休涕泪，莫愁烦，人生如朝露” 这种好片怎么还没有修复版啊', '如果真要用“大师”来框定许鞍华的话，这部作品同《天水围的日与夜》当仁不让是双璧之作，通体朴素、浑然天成、大音希声，不多废话，看似搞笑的场景也都是日常人做得出的，同时又是非常到位的地理与历史意义的明确指向，真是好，太到位', 'Summer Snow. “人生啊，真是很有趣”，苦至极致反会找到乐趣，看似过不去的却都过去了，阔海空天尽显。不幸的开始到头来可能是拉扯住生活不再下沉的稻草。“我的青春小鸟一去不回来”，无常世事，最动人处是看开。“休涕泪，莫愁烦，人生如朝露。” 最后那一定格，框定此前人生，诉尽完全心事。', '想到了我们之前的领导，工作勤勤恳恳，回家任劳任怨。不光照顾公婆，连小叔子妯娌都要她伺候，问就是她能干，别人学不会，牺牲自己，成全一家。片子里更甚之，最好笑的是女主老公恬不知耻的问“你最大的幸福不是跟我结婚吗？你的快乐不都是我给的吗？”哈？这福气给你你要不要啊？别歌颂这种自我牺牲下的合家欢，让女人好好做自己的事业，行不行啊？', '8/10。开头阿娥提大小包等活鱼死去，点明了精打细算的女性形象。用忍耐家公的老年痴呆获得信赖引发喜剧氛围，借此设计出家公拿伞想飞、画箭头示意上厕所、装扮疯子哄骗他和劝说去防空洞（躲避邻居扔废物抗议）等幽默技巧，顶着懂电脑的漂亮同事的竞争压力，直到全家郊外耕种的去世落幕使观众笑中带泪。', '《女人四十》 许鞍华 1995年 许鞍华的家庭叙事片是我见过最真实自然的，每个人都可以在她的电影中找到自己家庭的影子。她没有杨德昌那种哲理性的教条，没有李安那种柳暗花明的思维穿透，她演绎的就是最最真实的生活。 一个女人到了四十岁，需要面对工作，需要每天煮饭洗衣服，需要照顾老了的父亲，照顾年轻的儿子，跟丈夫的感情也早就脱离了爱情式的浪漫了。这些都是真真实实存在的。 许鞍华还有一部《男人四十》，是张学友演的，讲的是男人到四十岁后面对少女的诱惑，在无聊的婚姻与外围诱惑的抉择。', '赶巧，在三八节看了这个片子。萧芳芳的女主角演得真好。演活了一个在家庭，工作中苦苦支撑的女人。其实电影也着重于描写围绕在女主角身边的人：公公，丈夫，儿子，同事……尤其是乔宏演的公公。查了一下乔宏老爷子的生平，再看他对片中老年痴呆患者的演绎，实在让人感伤', '哎，真不知自己以后四十岁会是如何？希望我会是37度的女人。片中的萧芳芳演活了，是个大大的好媳妇啊。这片子或许时代些许脱节了，但片子中女人四十面对生活各种辛酸无奈艰辛所呈现出来的态度，情怀永远不过时。乔宏的演技也很到位。结局他说：“人生是很过瘾的”。。。。。', '不愧为许鞍华导演最佳电影之一，竟是如此生活、如此温馨、如此搞笑、又如此意味深长的作品；故事和台词真的很棒，虽然观赏前对剧情几乎不了解，但在影院一想到这是有关“老年痴呆”引发的生活问题题材的电影，还拍得不沉重反而如此有趣，真的很厉害。编导演都超级出色，那欲言又止的结尾太妙了。@影博', '昨天在资料馆看的大银幕，没想到乔宏演的这么真实。关注小人物，关注人的生活状态，关注真实的细碎感情，许鞍华在这方面是文艺片翘楚。期待她的《黄金时代》，给我们一个新的萧红。']","['https://img9.doubanio.com/view/photo/m/public/p2441944656.webp', 'https://img9.doubanio.com/view/photo/m/public/p2154036744.webp', 'https://img9.doubanio.com/view/photo/m/public/p2352215676.webp', 'https://img2.doubanio.com/view/photo/m/public/p2181460542.webp', 'https://img9.doubanio.com/view/photo/m/public/p2538246446.webp']",./data/post_video/许鞍华/女人四十/image,"['https://img3.doubanio.com/view/photo/sqxs/public/p476141300.webp', 'https://img1.doubanio.com/view/photo/sqxs/public/p476141698.webp', 'https://img2.doubanio.com/view/photo/sqxs/public/p476141952.webp', 'https://img9.doubanio.com/view/photo/sqxs/public/p2441948884.webp', 'https://img9.doubanio.com/view/photo/sqxs/public/p2697902066.webp']",./data/post_video/许鞍华/女人四十/image,[],./data/post_video/许鞍华/女人四十/video
