电影名,电影网址,导演,编剧,主演,评分,评分人数,评分额外信息,类型,制片国家/地区,语言,上映时间,时长,剧情简介,获奖情况,热门评论,海报链接,海报保存路径,剧照链接,剧照保存路径,视频链接,视频保存路径
辛德勒的名单 Schindler's List,https://movie.douban.com/subject/1295124/,史蒂文·斯皮尔伯格,托马斯·肯尼利/斯蒂文·泽里安,"['连姆·尼森', '本·金斯利', '拉尔夫·费因斯', '卡罗琳·古多尔', '乔纳森·萨加尔']",9.6,1003091,"好于99%战争片,好于99%历史片",剧情/历史/战争,美国,英语/希伯来语/德语/波兰语,1993-11-30(华盛顿首映),195分钟,1939年，波兰在纳粹德国的统治下，党卫军对犹太人进行了隔离统治。德国商人奥斯卡·辛德勒（连姆·尼森 Liam Neeson 饰）来到德军统治下的克拉科夫，开设了一间搪瓷厂，生产军需用品。凭着出众的社交能力和大量的金钱，辛德勒和德军建立了良好的关系，他的工厂雇用犹太人工作，大发战争财。1943年，克拉科夫的犹太人遭到了惨绝人寰的大屠杀，辛德勒目睹这一切，受到了极大的震撼，他贿赂军官，让自己的工厂成为集中营的附属劳役营，在那些疯狂屠杀的日子里，他的工厂也成为了犹太人的避难所。1944年，德国战败前夕，屠杀犹太人的行动越发疯狂，辛德勒向德军军官开出了1200人的名单，倾家荡产买下了这些犹太人的生命。在那些暗无天日的岁月里，拯救一个人，就是拯救全世界。,"['最佳影片', '电影类 最佳剧情片', '电影奖 最佳影片']","['有钱才能保护喜欢的人', '印象很深刻的是黑白画面中的红色。', '这不止是剧情，更是技术、镜头、剪辑、演技和配乐的综合胜利。表达是一出技巧活，不以剧本和背景定优劣，这一切都是导演的功力和运气造成，不可求，但可遇——《辛德勒的名单》可谓厚积薄发。而实论背景，辛德勒本人之事尚存争议，电影却已在全世界人面前诠释并且定性了，由此可见媒体的影响之大', '出门的时候，看到灯火辉煌的城市，会觉得一切幸福美好都是罪恶。。。', '导演很清楚观众会喜欢什么，而这正是我不喜欢的地方', '最后辛德勒摘下自己的胸针，说自己原本还能再救一个人，痛哭失声的时候，我也已经哭得不成人形。从电影的任何一个角度都达到了直击人心的力量，面对人性，面对生命，辛德勒做出了让历史铭记的选择。经典之至，感人至深。', '“凡救人一命，即救全世界！”一段如此深刻的历史，多么希望它早早结束，但如此一部经典的影片你却永远都不想它完结。感动于良知，印象很深刻的永远是黑白画面中的那一抹红色。在任何时代，不管有多么的黑暗，都会有人性的光辉在闪烁着；经典的影片也不会因为缺失色彩而让人觉得沉闷。★★★★☆', '“你从来不喝醉，那是绝佳的自制力。自制力就是权力。” “权力是当我们有绝对的理由去杀一个人的时候，我们却不那样做。那是古代帝王风范。那才是权力。”', '不仅仅是犹太人，而是整个人类的悲剧。', '请看一部没有笑容的电影吧', '连姆·尼森后来又演了《通勤营救》《空中营救》《飓风营救》，半辈子都在营救别人。幸亏《辛德拉的名单》当年没在中国上映，要不然中文译名可能会是《辛德勒营救》。', '救人一命就是救全世界.', '救人一命等于救全人类。集中营进得来，出不去，除非你从焚尸炉的烟囱里爬出去。', '辛德勒犹太人献给辛德勒的指环上写着：“凡救人一命，即救全世界。”当1100这个数字具化到一个个人名的时候，当片尾处影片中被救的犹太人原型出现时，才能真真切切地体会到指环上的那句希伯来经文的深刻。', '这类片子，在我的概念里，和读书时四大名著同等级别，大部头，轻易不敢触碰，一旦决心看就要掏心掏肺100%投入。很辛苦。看完都像心灵负重走了长征。平庸之恶也许只是借口。真的猛士敢于面对人性的黑暗与软弱，敢于跳到体制中做出自己的选择。像伟大的犹太裔导演斯皮尔伯格致敬。', '我哭死算了我', '很棒，直击人心。不知道什么时候中国也能拍出这样的电影。', '每一次看都有新鲜发现，每一次看都会内牛满面。/ 记第一次在中国大银幕观看 20190413 @天幕新彩云巨幕厅', '斯皮尔伯格，犹太人，世界最著名的导演之一，他通过黑白映像把第二次世界大战中德国纳粹犯下的滔天罪行传播到世界各地，那段对犹太人灭绝人性的杀戮终于大白于天下。 苍天悲悯，辛德勒名单内是生命，外是死亡，他为此倾家荡产，1100犹太人得已生还，也记住了辛德勒这位伟人。', '又看了一遍《辛德勒的名单》。斯皮尔伯格像小学生第一次交作业一样用心、虔诚、小心翼翼。每个创作者都该记住自己的这个第一次。', '特别喜欢的片子，心里特别难受，从音乐到场景都是很压抑、很凄凉。当看到犹太人把金牙抠下来铸成了一枚戒指送给辛德勒那段时我已不禁泪如雨下。这部电影无论是在思想、剧情、摄影、音乐都做到了目前战争片的极致水平。', '辛德勒的名单，当时我看成希特勒了，还以为是间谍片，后来看了发现是救赎片。二战时期的片子大多是在救赎和摧残中纠结。日光之下再无鲜事。不过不能否认影片很不错。', '人性之恶，生命之荒谬', '爱电影必看的一部，黑白色里的红衣小女孩和温暖的烛光令人印象尤其深刻——导演很清楚我们需要怎样的震撼和感动', '对里面纳粹扫荡犹太区，辛德勒立马山头那段印象很深，那抹全剧中唯一的红色真的让无数人揪起了心。约翰•威廉姆斯的犹太童谣配乐配得太好了，特意去搜了下中文歌词，无论我说错了什么都不要在意，我只想要你好好回来。。', '黑白影像，关乎生命，在每一个长镜头里，都看到生命的跃动', '主旋律，片段化，但是掩饰不住那份执着和认真的制作态度。最美的摄影果真都是黑白。光影运用极其出色。若干小高潮和小细节令人惊愕。让英国演员蹩脚的说带德国口音的英语到底还是阻碍了表演，让人出戏并加强做作感。人物塑造尚可，男主前后反差有点大，过渡没有做好，最后拔高有刻意感。', '我可以冷漠的看完整部影片。我深知我改变不了世界甚至改变不了自己', '人性的罪恶会被扩大和释放，当你所处的社会无比黑暗，压抑时！', '是经典,都该看一看.', '美好的人性给我们这个丑恶的世界带来了一点希望。20200926重温。', '这部电影的价值是用影调还原了值得铭记的一段故事，或许经年以后屠杀犹太人从近代史划归到古代史，这场灾难的伤痕逐渐淡却，依然会有后人因这样一部电影记得人类曾有过的仁慈与博爱。黑白影调中红衣小女孩和温暖烛光成为经典，《另一个故乡》也有运用。故事上《钢琴家》后来亦有诠释，但经典值得永恒。', '种族灭绝在任何时代都是残忍的。当年是德国对犹太人，而现在是西方精英统治阶层对全世界的有色人种。中国人，警醒起来，不要忘了历史上的教训。大部分美国电影都是中情局控制下的好莱坞生产的精神鸦片。详情见这本书《好莱坞内部的中情局》http://book.douban.com/subject/26370014', '佛说救人一命胜造七级浮屠，慈悲的伟大在于重视生命大于利益', '25周年大银幕重映，斯皮尔伯格特地加了一段intro。资本家的但丁神曲。', '辛德勒名单，高中课本就有这么一篇课文，老师在上到这节课时给我们放了这部影片，深刻的感受到战争的残酷。', '全片黑白，那个红色衣服的女孩太亮眼，亮眼得有些刺目。总有人说影片具有长久的意义巴拉巴拉，个人觉得任何东西都有时效性，就像我现在看永远都不会有那个时候人们看时的震撼……', '看完好激动，总之不管坏人好人手里还是要有钱有权才能肆意', '任何时刻，生命都值得被尊重，不允许任意践踏。', '辛德勒就是个大好人，救了好多人的性命，我印象最深就是扫雪那里。', '它深刻地揭露了德国法西斯屠杀犹太人的恐怖罪行，并且具有极高的艺术性，它的思想的严肃性和非凡的艺术表现力都达到了几乎难以超越的深度。我们为它颁发奥斯卡大奖，对于影片的成就来说这是当之无愧的。而史蒂芬·斯皮尔伯格也以此片第１次夺得了奥斯卡最佳导演奖，对于他的才华来说，这是一份迟到的肯定。——第６６届奥斯卡奖评委会', '以前不爱看 现在觉得超牛逼', '这是斯皮尔伯格一生最伟大的作品。只是在茫茫受阻抑或被屠杀的犹太人面前，在沧海桑田的历史面前，这依旧是微不足道的一笔，但同时也是它完胜一切赞颂人性作品的原因所在：如同那每一个看不见边界、看不见人群队末的镜头一样，善恶无常，絮絮不止。', '脑中回荡着耶利米哀歌。每一个镜头都撕裂我。', '战争中关于人性的思考。', '9/10。辛德勒出场伴随戒指、别针、领带和抽屉里的钱一系列特写，表明是注重细节的人，进入会计的办公室无礼地坐上桌使会计仰望着他，画面中辛德勒占据更大位置，从火车站救出会计时，会计苦苦解释像个可怜虫般挤至画面边缘，此时的辛德眼里只有权力：口头下令采购物品讨好纳粹军官之后，时空转换到犹太工人各地匆忙采购水果、罐头等物品，这组声画对立意在表现犹太人拿工作换命，被辛德勒的权力利用的不平等地位，天空飘舞到车上的骨灰、焚尸堆死掉的红衣姑娘则唤醒辛德勒的人性；阿蒙象征精神分裂下法西斯的残暴，有一场戏他听取辛德勒关于权力的建议，接着照镜子看了一眼女仆修的指甲：他嫉妒辛德勒敢公开亲吻犹太姑娘，克制不了对女仆的爱在地窖殴打她，镜像自我唤醒情欲的杀意，射杀之前赦免的男孩。拿狙击枪扭脖子做早操的日常动作突出人性邪恶面。', '影片在压抑与感动中看完 唉 战争无情人有情 据说当时是可以制作彩色电影的 只是为了更好的表现剧本 导演选择黑白电影 除了那个小女孩的红色身影外', 'Amon是一个塑造的比Schindler更立体的人物…信仰、情感与人性的冲突、矛盾和对立…像电影里说的“也许…你不是错的，错的是这个世界”他爱上了Helen但是他不敢承认，他对Schindler说想要带Helen回家与她白头到老…但 nazi 他所一直服从的信仰 不允许他承认 不允许他去爱。他明知道Schindler 的行为是为了什么 目的是什么 但他默许了。在Schindler亲吻犹太女孩之后找借口为他求情。Amon像一个没长大的孩子，对很多事情是迷茫的，nazism好像是他唯一可以依靠的东西。在Schindler告诉他“饶恕才是权利”之后，他像个孩子一样 用一种与平日commander截然不同的语气尝试着说出饶恕 的话语，往日他从未讲过的话语“ i forgive you” 十分的生疏', '也是因为这部电影揭露了纳粹的残暴恶行 以至于不管什么想起我总是觉得莫名恐惧 但依然能感受到这世间的美好', '片中的剧情，技术、镜头、剪辑、演技和配乐都很不错。我觉得男主的人设也不错，由冷漠势力到有血有肉']","['https://img2.doubanio.com/view/photo/m/public/p492406163.jpg', 'https://img1.doubanio.com/view/photo/m/public/p2543441827.jpg', 'https://img9.doubanio.com/view/photo/m/public/p1883257846.jpg', 'https://img2.doubanio.com/view/photo/m/public/p2543653052.jpg', 'https://img2.doubanio.com/view/photo/m/public/p492406461.jpg']",./data1/post_video/史蒂文·斯皮尔伯格/辛德勒的名单 Schindler's List/image,"['https://img1.doubanio.com/view/photo/sqxs/public/p2533777548.webp', 'https://img2.doubanio.com/view/photo/sqxs/public/p2581177631.webp', 'https://img1.doubanio.com/view/photo/sqxs/public/p2214090809.webp', 'https://img1.doubanio.com/view/photo/sqxs/public/p825996608.webp', 'https://img1.doubanio.com/view/photo/sqxs/public/p2563777927.webp']",./data1/post_video/史蒂文·斯皮尔伯格/辛德勒的名单 Schindler's List/image,"['https://vt1.doubanio.com/202204252105/1a62245c9a7f37c326964ff46d3684cf/view/movie/M/402410178.mp4', 'https://vt1.doubanio.com/202204252106/79af900d93c094665c4a667be9d8ef95/view/movie/M/402350662.mp4', 'https://vt1.doubanio.com/202204252106/7733984fd82a87d35ef27d815e79baa2/view/movie/M/301080755.mp4', 'https://vt1.doubanio.com/202204252106/73392dede2116644a700d3f8fac401fd/view/movie/M/301300903.mp4']",./data1/post_video/史蒂文·斯皮尔伯格/辛德勒的名单 Schindler's List/video
