电影名,电影网址,导演,编剧,主演,评分,评分人数,评分额外信息,类型,制片国家/地区,语言,上映时间,时长,剧情简介,获奖情况,热门评论,海报链接,海报保存路径,剧照链接,剧照保存路径,视频链接,视频保存路径
公民凯恩 Citizen Kane,https://movie.douban.com/subject/1292288/,奥逊·威尔斯,赫尔曼·J·曼凯维奇/奥逊·威尔斯,"['奥逊·威尔斯', '约瑟夫·科顿', '多萝西·康明戈尔', '阿格妮丝·摩尔海德']",8.8,101448,"好于95%剧情片,好于98%悬疑片",剧情/悬疑,美国,英语/意大利语,1941-09-05(美国),119 分钟,美国报业大亨凯恩（奥森•韦尔斯）在桑拿都庄园中留下“玫瑰花蕾”的“遗言”死去后，一位青年记者受媒体的委托调查这四个字的含义，遂即，他走访了凯恩生前的同事好友，从报社董事长伯恩斯坦的口中，了解到凯恩的发迹历程以及如何制造舆论使美国卷入1897年的战争中的往事，从利兰的讲述中，凯恩与美国总统的侄女爱米丽的婚姻、与第二任妻子（歌手）苏珊的复杂关系及在总统竞选中的失败等等也被他一一所知。听过大量的讲述后，该记者又去图书馆查阅了有关凯恩的详尽资料，凯恩更多的一面，青年时代的经历及与母亲的关系也被他知晓，然而，“玫瑰花蕾”四字的含义，他仍不得而知。,"['最佳影片(提名)', '最佳导演(提名)', '最佳男主角(提名)']","['销魂深焦、低调灯光、5个叙述闪回的平行运动镜头切入、升降横摇镜头、蒙太奇造就的时间维度、复杂场面调度，包括服装化妆声效等，无论你们怎么说装逼，这些技巧的确无与伦比！', '1.人的一生就是在不断的得到和不断的失去。 2.人的一生不过就是几个他人的片段回忆所组成的故事。 3.人的一生终将化成一股黑烟飘向天空。 4.每个自我意识膨胀的人都渴望在自我和他人的领域里当一个暴君。 5.影片的技术——深焦、长镜头、剪辑达到了神一般的高度。', '天才是这样做的：深刻的内涵，革新的电影语言。但是这样从来不会生产出为大众所追捧热爱的电影。以车为例，它是概念车。', '神烦那种说着‘这种电影放到现在根本一文不值’言论诋毁老电影的人。傻逼都知道技术在不断革新。那么你也可以说金字塔根本没什么了不起的现在造几个毫无压力，推倒算了。公民凯恩的确不愧为美国历史上最伟大的电影。虽然没有国际性的奖项捧着，但是这部电影根本不需要这些。时间总会证明伟大的东西。', '将近七十年前威尔斯玩的玩意儿，现在的导演还在玩', '当我们谈论《公民凯恩》的时候我们在谈论什么：玫瑰花蕾？深焦摄影？背景画？没有眼睛的白色鹦鹉？1941抑或26岁？当一部电影被太多排名列为榜首、被太多专业人士和非专业人士分析过，当一部影片被认定为”经典“后，后世观者已经感受不到除了经典的东西了。某种程度上也扼杀了一种平常心的感受力。', '果然是超天才和华丽的镜头和剪辑，已经是70多年前了，现在这些技术还在被用到。。。再大的人物，一生也只不过是活在特定几个人的记忆里啊，原来玫瑰花蕾是那么回归本源的东西。悬疑传记片。不过实在无法对此人有什么认同。。。故事也不刺激。。。', '阅片一千在此葬送。多人叙旧拼接出主角一生、各类教科书镜头集大成，其里程碑意义与学院派的模范性质都显而易见。故事的源头都在于过早被喧嚣之欲剥夺的童年。其实他没有死在断气的时候，而是死在象征纯洁的雪橇被当成废品烧为灰烬的时候。只欣赏不赞赏，不认同影史最佳称号。→18.11.11 二刷。升一至四。', '看到一半以后渐渐理解这个孤独的老人。从那个雪天，他告别玫瑰花蕾般的童年，就注定了孤独。他想得到政界的成功，而因为苏珊，他与州长一职失之交臂。苏珊就是他用来填补孤独心灵的，他把她当了宝，捧上天，才发现她不过是块石。他还是想她留下，在偌大的宫殿里陪陪他。他只是太孤独了，直到死。', '以「玫瑰花蕾」悬念开场，喜欢电影里的叙述角度，基本都是以第三人转述的凯恩，于是凯恩在不同人眼中有不同的性格。电影很精彩，没有快进。到片尾，终于明白了「玫瑰花蕾」为何物，那是他得到又失去的东西。凯恩只是个孤独的大男孩，all he needs is love.', '挺好看的，别动不动就用现在的眼光苛求它，没有98哪来的windows7？', '固执的人与狂傲的人生。手法、镜头和美术都很惊人', '奥胖自己说，这是个喜剧，但看到最后，又是个失爱亲离被抛弃的悲剧。每一个镜头都相当精致，尤其印象深刻的是对比强烈的布光和景深的运用。演员的对话站位，譬如那场185号的四人对峙。他与来自全世界的雕像住在宫殿里，不愿接受断舍离的源头，居然是童年的那场雪。悬疑？生而为人，大概就是最大悬疑。', '主要优秀之处在电影语言的登峰造极上（多视角回忆的非线性叙事、广角镜及对深焦摄影的运用、低角度机位与繁复的封闭式构图、时空转换、出彩的蒙太奇、匹配剪辑和声音剪辑、考究而不乏隐喻性的服装与布景等），主题深刻而极具多义性，对美国梦幻灭的反思这一母题也至今不断在各种影片中出现。', '“总括一切有声电影问世十年来的技巧”，最大意义拓展电影语音的基本形式与结构方式，打破传统电影线性因果关系为主线的叙事方式；主题与线索玫瑰花蕾，首尾呼应开放式结构；客观真实与主观意向结合，段落镜头，纵深深焦，阴影逆光，同一场景中长分镜头不同剪辑风格，音响蒙太奇', '半程之后才隐隐约约大概明白为什么是好电影...没字幕看得我泪流满面...', '我喜欢本片，不是因为它在电影史上有多高的地位，也不是因为它被称为电影教科书，而是因为它是一部真正意义上的好电影。它在同类型、同级别的电影中并不算长，但它以深刻而细腻的笔触刻画了一个巨人的一生，它带领着观众见证伟大中的渺小，辉煌背后的悲戚。如今的观众已对黑白产生了本能的排斥，遗憾。', '我之前可耻地没有看过…太流弊了，长跪不起，威尔斯时年26岁，这就是传说中的天生为神吧…', '（７／１０）虽然剧情被很多人说很沉闷，但影片的拍摄手法却是超前的，这些电影表现形式放在今天司空见惯，但放在当时却是重大的突破（常看默片的话就能感受到这点），而完成这些创新的导演，正是当时只有25岁的奥逊·威尔斯，很多人在这个年龄也就只是在B站上剪个视频当下网红，而威尔斯已是个很有才华的导演。凯恩的原型赫斯特对这片很不满，但他的孙子却很喜欢。另外女主的原型并不是一个蹩脚歌星，相反她被威尔斯认为很有表演天分。', '看了很多次，始终看不完。到底好在哪里？', '电影业各工种教科书', '自我中心者的失败，结构与镜头 。。。但仍是过誉的电影 只对学电影的和电影史论者有作用', '一辈子都看不完的电影，但是不得不说是经典，所有老师举例子都会说到它的', '该片的剧本真是绝了，想拜读一下原剧本。拍摄手法亦高明，景深拍摄的运用很得体。我个人最喜欢的一段戏还是凯恩和他第一任夫人时长9年却转瞬即逝的早餐戏，言语表情皆精彩。无疑这是一部杰作，尤其是从我最关注的文学性角度来说。', '拍摄手法今天看已不新鲜，可能是被后世抄太多了吧。没有任何字眼可以解释凯恩的一生，但“玫瑰花蕾”却成功把悬疑从头带到尾。凯恩这个人物让我想到了菲兹杰拉德小说。', '教科书你不一定喜欢读，但教科书不愧是教科书。一个男人总会记得些你不认为他会记得的东西，你以为他的浪漫是丰功伟业、香车美女和叱咤风云，他却总是执念些自己失去的、没有的东西，而在追求这些东西的时候，他自然又会失去更多。凯恩这一生，爱人，但更自爱；助人，但都出自私心。他的一切悲剧，都源于自命不凡，又源自出自童年的自卑、渴望爱。', '一个人在传媒视频里是一个模样，在下属眼中又是一个模样，在伙伴眼中又是另一个模样，在前妻眼里又变成了另外一幅面孔……一个人的故事里，尽是其他人的视角，这让我们离一个人的本质越来越近，也越来越远', '这是我在豆瓣标记的第1800部影视作品，特意挑选这部“影史公认最伟大的电影”，好让在我的观影史的时间线上有一个灿烂的坐标。孤傲自负如奥逊威尔斯，想必也没有料到他在25岁自编自导自演的电影竟可以称霸《视与听》杂志影史第一宝座长达50年之久，在2012年终于被希区柯克的《迷魂记》挤了下来。这的确是一部有较高鉴赏门槛对多数观众不算友好的片子，然而它能够被奉为教科书式的电影自有其精妙绝伦之处，倘若因为自己的审美水平有限就轻松否定本片，随性地留下一句看不懂则就有点儿把无知当骄傲了，当然反过来用公民凯恩来炫耀自己的品位一样大可不必。奥逊威尔斯在1941年利用多视角叙事和对景深镜头的创造性运用，结合高超的打光、蒙太奇技巧，就好比在大家都还习惯在PPT中用着丑爆的艺术字时，突然看见有人竟然已经会熟稔运用神奇移动时产生的震撼。', '镜头太棒了！！！', '久仰大名了，一直听说很牛逼，现在才知道为什么牛逼！原以为70年过去，这片一定晦涩拖沓无聊。没想到摄影、剧情、剪辑、调度、演员、配乐等居然毫不过时，伪纪录片+调查体+第三人称回忆体叙事结构至今仍光芒四射创意无穷，万分精彩，感慨唏嘘，拍腿叫绝！奥森威尔斯简直是天才！//20150617上影节大光明', '其一，這部片的原片名是《美國人》（American）；其二，男主角稱呼自己的情人是「美國大眾的橫切面」（a cross-section of the American public）；其三，導演以美國觀眾看不出這是一部「諷刺喜劇」而感到遺憾。', '当之无愧的神作！！！这个片必须得有一定看片量才能发觉它的好。剧本结构、镜头设计、剪辑、构图、打光、布景、化妆、服装、声音、配乐、表演、导演，全方位出色。Orson Welles真乃天才。', '下半辈子装13就靠这个洋葱了~', '9.9分，这电影不进top250是豆瓣最大的失策。《阿甘正传》是浪漫成功的人生，《公民凯恩》是凄凉现实的人生。""玫瑰花蕾""是凯恩小时候最喜欢的滑雪板。这个世界有几个人会知道、会在意你喜欢什么？我们死后我们所爱的事物就会被人嫌弃的丢弃。有人可能不太能接受凯恩的为人，但请别忘了，每个人都或多或少有一定的控制欲，都想要被人爱，想要被人理解。你可以不喜欢凯恩，但不能否认你身上有一些凯恩的影子。', 'Rosebud既指称着层层剥离的多角度叙事结构，更具有哲学深度：结局处，当滑雪板上玫瑰花蕾图案被熔焠，我们明白“中心”是不可抵达的，甚至并不存在，所有语词的撞击皆属徒劳。伟大的景深镜头+精巧的叙事装置。', '1.契约，或者说约定的被破坏是灾难的开始；2.他对于社会契约论并不了解，这和他受的博雅教育矛盾；3.他只爱他自己，或者他根本不知道什么是爱；4.他的一生可能是全球向左转年代的一个缩影，无论是爱人民还是被人民爱，想法差的越来越远，这就像一个Fairy Tale，就如莫名其妙的中彩', '汪洋恣肆，尽显风流；尤其那景深的使用，看得人浑身颤栗。', '终于看了这部经典，也同时明白了为何被称为经典。解读角度太多反而不知从何说起。不过也许现实中奥逊·威尔斯的一生才跟公民凯恩有着互文对照的最大意义吧。电影人生，人在戏中，戏在画外。', '超好的叙事，超好的灯光~ 超烂的字幕。。。 算我倒霉', '四星半，不入。不愧是现代电影们的开山鼻祖啊', '镜头真华丽啊。不过对于这个人物，或者人物的塑造完全提不起任何兴致。看来我对鼻子长在脑袋上的人物确实不买账。。。', '以前读过焦雄屏翻译的《认识电影》，全书前十一章引述了数百部电影分别介绍从摄影、剧本到表演、语言的电影理论，最后一章是对全书的综述，章名就四个字：《公民凯恩》。不管光影还是音景，始终不能让我相信这是部拍于1941年的电影。', '奥森威尔斯26岁时候拍出了公民凯恩 我26岁的生活和黑白电影一样丰富多彩', '初次观看这部影片必然不以为然，只因被盛名所累。再次再再次时必将折服。反正我这次没看懂，下次折服与否再议。。。顺便一提：“玫瑰花蕾”(Rosebud)这个被小凯恩用来称呼雪橇的名字，原来是赫斯特(凯恩)对戴维斯(苏珊)身上一个最隐私部位的昵称。', 'Orson Welles确实天才，和Joseph Cotten几段对手戏两个人都魅力十足，凯恩这个角色某种程度上也是Welles的写照，天才却自负，能力出众又狂妄自私，一个人的一生不过是几个人嘴中片段的融合，就像苏珊没完没了在玩的拼图。有几个场景拍的真是赞，镜头语言没得说，但我也确实没参透这片的绝赞之处。', '“撒他一天一地的热血然后问‘你看到了吗’”，大概就是史铁生说的那种人。有一颗爱世界的心、鞠躬尽瘁，但凯恩却无珍惜身边人的能力。原以为挺难啃的片、很早就知道剧情，却也从中途就一边看一边跟着伤感。梦想是个笑话，但“一切愤世嫉俗均来自理想的破灭”不是么。前有大国民、后有教父。', '哎这就是那部总是搁置的影史经典：太多沉重，太多感叹，电影本身反而都得往后站。Orson Welles那时还带着稚嫩的面庞啊！听他的radio work，看他的第一部短片，再看这个，我面前浮现的不是神，而是一个做什么事情都要求自己有创意有思考并且会主动去寻找实现创意的机会的年轻人。', 'Timelessness，总会想到Ed Wood和Orson在小酒馆的相遇，虽然地亩勃炖只是挖掘了对于电影的爱这一部分就已经很难能可贵了', '争议最大的奥森威尔斯作品，根本不像是来自一个涉世未深的二十多岁小伙子。镜头景深层次感极强，以旁观者的视角拼凑叙事，井底望天的回溯与跋涉。那股社会角力来袭的时候，只有票民、选民和自己；我不认为几句话就能概括人的一生，rosebud也只是这拼图里的一块，不过恰巧是丢失的那一块。', '很不错，挺经典的']","['https://img1.doubanio.com/view/photo/m/public/p1474928139.jpg', 'https://img2.doubanio.com/view/photo/m/public/p1474928122.jpg', 'https://img1.doubanio.com/view/photo/m/public/p2640699029.jpg', 'https://img3.doubanio.com/view/photo/m/public/p2500617870.jpg', 'https://img1.doubanio.com/view/photo/m/public/p2461463229.jpg']",./data1/post_video/奥逊·威尔斯/公民凯恩 Citizen Kane/image,"['https://img2.doubanio.com/view/photo/sqxs/public/p834374463.jpg', 'https://img1.doubanio.com/view/photo/sqxs/public/p1943119509.jpg', 'https://img2.doubanio.com/view/photo/sqxs/public/p1161108333.jpg', 'https://img2.doubanio.com/view/photo/sqxs/public/p723505033.jpg', 'https://img2.doubanio.com/view/photo/sqxs/public/p2627874922.jpg']",./data1/post_video/奥逊·威尔斯/公民凯恩 Citizen Kane/image,['https://vt1.doubanio.com/202204301415/170e552a600ff174f24081fd98e0e092/view/movie/M/301380596.mp4'],./data1/post_video/奥逊·威尔斯/公民凯恩 Citizen Kane/video
