电影名,电影网址,导演,编剧,主演,评分,评分人数,评分额外信息,类型,制片国家/地区,语言,上映时间,时长,剧情简介,获奖情况,热门评论,海报链接,海报保存路径,剧照链接,剧照保存路径,视频链接,视频保存路径
发条橙 A Clockwork Orange,https://movie.douban.com/subject/1292233/,斯坦利·库布里克,斯坦利·库布里克/安东尼·伯吉斯,"['马尔科姆·麦克道威尔', '帕特里克·马基', '迈克尔·贝茨', '沃伦·克拉克', '约翰·克莱夫']",8.6,333631,"好于96%犯罪片,好于92%剧情片",剧情/科幻/犯罪,英国/美国,英语,1971-12-19(纽约首映),136 分钟,阿利斯（马尔科姆•麦克道尔）是一位无恶不作的少年，他的特殊喜好是边听贝多芬的交响曲边奸淫女性，某次他进入一所别墅抢劫一番后，打残了该别墅的主人——一名小说家，并用特殊喜好蹂躏了其妻子。后来因为杀了一名单身女子，阿利斯入狱并接受了特殊的人格治疗，出狱后，他对淫乐之事产生彻底的厌倦。但当阿利斯回到家时，周围人群没改变对他的旧看法，在种种歧视的重压下，他跑到郊外一所别墅想喘口气，不想这所别墅正是他以前抢劫过的小说家的那所。而作为反政府组织首领的该小说家为了达到某种目的，软禁了阿利斯。当这件事暴露小说家被捕时，其手下为了对抗政府，扬言要把阿利斯恢复原来的性情，完全不理一旁的阿利斯大叫“我完全好了”。,"['最佳影片(提名)', '最佳导演(提名)', '帕西内蒂奖 最佳外国电影']",[],"['https://img9.doubanio.com/view/photo/m/public/p529908155.jpg', 'https://img9.doubanio.com/view/photo/m/public/p2457576155.jpg', 'https://img2.doubanio.com/view/photo/m/public/p2173715882.jpg', 'https://img3.doubanio.com/view/photo/m/public/p529904910.jpg', 'https://img2.doubanio.com/view/photo/m/public/p529875603.jpg']",./data1/post_video/斯坦利·库布里克/发条橙 A Clockwork Orange/image,"['https://img9.doubanio.com/view/photo/sqxs/public/p455359554.jpg', 'https://img2.doubanio.com/view/photo/sqxs/public/p1286563702.jpg', 'https://img1.doubanio.com/view/photo/sqxs/public/p455358587.jpg', 'https://img2.doubanio.com/view/photo/sqxs/public/p2574738393.jpg', 'https://img9.doubanio.com/view/photo/sqxs/public/p2363832626.jpg']",./data1/post_video/斯坦利·库布里克/发条橙 A Clockwork Orange/image,['https://vt1.doubanio.com/202204301944/291a0a89ea3365dcdd5336b74fc20d79/view/movie/M/301370732.mp4'],./data1/post_video/斯坦利·库布里克/发条橙 A Clockwork Orange/video
2001太空漫游 2001: A Space Odyssey,https://movie.douban.com/subject/1292226/,斯坦利·库布里克,亚瑟·克拉克/斯坦利·库布里克,"['凯尔·杜拉', '加里·洛克伍德', '威廉姆·西尔维斯特', '丹尼尔·里希特', '雷纳德·洛塞特']",8.9,278690,"好于98%科幻片,好于99%惊悚片",科幻/惊悚/冒险,英国/美国,英语/俄语,1968-04-02(华盛顿首映),149分钟,这部影片是库布里克花了四年时间制作的充满哲学命题的鸿篇巨制。一块大黑石树立在史前人类的面前，他们刚刚开始认识工具，进入到进化的里程碑。同样的黑石还在宇宙多处出现，它们矗立在月球上，漂浮在太空中，带着某种神秘的寓意。现在的时间是2001年，为了寻找黑石的根源，人类开展一项木星登陆计划。飞船上有冬眠的三名宇航员，大卫船长（凯尔·杜拉 Keir Dullea饰）、富兰克飞行员（加里·洛克伍德 Gary Lockwood饰），还有一部叫“HAL9000”的高智能电脑。HAL在宇宙飞行过程中发生错乱，令到富兰克和三名冬眠人员相继丧命，剩下波曼和这台电脑作战。从死亡线上回来的大卫一气之下关掉主脑系统，HAL彻底失效。现在，茫茫宇宙中只剩大卫一人，向木星进发。穿越瑰异壮观的星门，大卫仿佛去到一个奇特的时空，那里有人类无尽的生死轮回和宇宙的终极知识……,"['最佳导演(提名)', '最佳原创剧本(提名)', '最佳视觉效果']","['首先你得忍者看完第一遍,觉得不知道在说什么;看了第二遍,觉得好像有点意思;看第三遍,知道原来这个电影讲述的是多个主题啊,看第四遍,觉得好像看懂了点什么;看了第五遍,啊,真他妈太牛了!这可是1968年的东西!', '这部片子有三个特征：1）看不懂 2）无数的符号 3）必须熟读尼采 4）六十年代能够做出这样的特效真的是惊天动地', '原作作者克拉克：“如果有人觉得完全弄懂了《太空漫游2001》在讲些什么，那一定是我和库布里克弄错了。”', '这部是唯一一出让我彻底游离出剧情，却始终带着浓厚兴趣看完的电影，我相信库布里克偏执的工作态度操死了一批又一批特效制作人员', '史上最伟大的装逼片，就连作者克拉克和导演斯坦利都看不懂剧情……不过这丝毫不影响它的伟大，首先在视觉上它领先了同一时代数十年不止，很多星际旅行片都没有给我一种“星际旅行”的感觉，但这部有，关键就在于细节处理细致。还有就是，这部讲述星际旅行的片子拍摄于1968年，而美国登月则在1969', '李安评价自己最爱5部电影之一时说： “我非常崇拜库布里克，关于《2001太空漫游》我无法说清它究竟是一部怎样的电影，我当年第一次看这部影片时，它深深地吸引了我，那种感觉就像吃了迷幻药之后的幻觉经历。” 今天在资料馆大银幕体验，修复版让这种幻觉变本加厉，渗入到每一根神经。', '这不是照着剧本拍的，而是曲谱', '《2001太空漫游》只获得了奥斯卡最佳视觉效果，而最佳影片和最佳原创剧本都只是提名。所以说啊，奥斯卡也不是权威。2014.1.17钦州', '对我，这是恐怖片，源自童年对星空的恐惧，关于人类的渺小。', '大！吃！一！斤！前20分，足以冻蒜一哥看过的影shi名作最难看（堪）的开场；传说中神乎其技的骨头蒙太奇，严格点就是一个语法错误。之后40分，又是影shi为展示视觉新奇削减叙事以致内容空洞无聊的典范，其有效信息不超过三分钟。配乐99%大而无当，加上你说了算之时空穿越，完全就是诺兰星际乱窜之父', '那奄奄一息的机械生命执意要为我唱一首雏菊，有那么几秒温柔得不像话。', '相当牛逼。又闷又飞。颜色很怪也异常美。65分钟时钢铁怪兽一般的喘息令人不安、惶恐，几乎要把自己的呼吸频率调整至与其同步。。96分钟时电脑杀人的戏冷静、残忍，让我简直有点无法承受。而在120-125分钟时，长达5分钟的高潮光效极其飞！！而最后的星孩令人恐惧！68年的迷幻范儿，巨屌！', '牺牲了部分叙事节奏，但构筑起来的完整世界让人目瞪口呆。我觉得我要暴走了：这怎么可能是1968年的电影！！！这怎么可能是1968年的电影！！！它反科学反伦理啊！！！', '叙事不够宏大的前提下，节奏略显缓慢。或许真应该以歌剧的心态来看，外行看热闹，只听咏叹调。', '这次看2001，库布里克穿越式的想像力提醒我，50年过去，人类技术并无本质上的进步：太空旅行和人工智能依然是前沿——而我们在这个前沿已经蹉跎了那么久。', '现代科幻电影的开山之作，文明进化的哲学片，史诗里的史诗。人类的渺小与广袤的宇宙相对比，更加深了我们对于自身命运的思考。当华彩乐章奏响的时候，生命的思维在没有起点，没有终点的宇宙里漫游，伸向无限的未知，探索那终极的意义。伟大的电影不朽，伟大的Kubrick不朽。', '人对宇宙的想象力，到此为止。最后半个小时，美到癫狂。本片让我对电影产生敬畏之心。有生之年，不会有任何一部电影能够超越此片。', '如果能在1968年看到这种电影，那游也要游到美国了吧', '最伟大导演的最伟大影片', '打死我也不相信库布里克是地球人。', '不好意思 我只能把经典电影给两星 因为不喜欢', '#库布里克影展# 配乐、声音、设计赞。三段结构也很妙。至于主题，除了人为机役外，第三段开头黑石漂浮在太空，简直就是iPhone广告，然后进入微信APP画面，然后人可以穿越时空宇宙但也迅速老去，最终在Deathbed上还伸出手指点向触摸屏——这未来的宗教！', '如痴如醉、半梦半醒啊，看到后面觉得很惊悚，尤其是星云变幻！！！在《地心引力》之前能补一遍这次大银幕，太知足', '光配乐已经足够5星了', '不好意思，下个世纪的人也看不懂这电影。', '中间还是睡着了几次……不是我的菜吧……但不能否认这片子做得真精致，而且还是60年代拍的，太空站、宇航服、宇宙飞船，都经得起长时间的细看。我只能说不明觉厉了……', '现在这个年代没人敢如此玩观众了。', '查拉斯图拉如是说出来的时候给震住了 不然估计看不下去 可能就错过如此的一部经典啦 画面超赞 优雅 有质感 让人难以相信是40年前的作品', '反复睡着影响了我对此片逻辑的梳理和判断……', '太厉害了哎 这哲学思维。。。宇宙的力量或许远远超乎现在生老病死的自然规律！配乐。。。泪。这是1968年的片子啊…………', '对于任何时代而言，将这些镜头语言、配乐、工业设计放在一部科幻电影，或者说放在一部电影中，都是极其奢侈的，从美的角度讲，这是标杆。库布里克塑造了一个根植于人类内心的宇宙，使科幻模型仿佛有了生命感。《地心引力》跟它一比，格调上就显得媚俗了。就好像杨幂遇见了林青霞。', '2001太空漫游时，人与电脑互不信任，交流也是冷的。2014Interstellar人与电脑的互相信赖、配合与默契，不只让人觉得萌萌的，还很温暖安全。即使它选择自我牺牲，你亦尊重。', '哲学命题的最佳叙事，形式上和贝拉塔尔的做作法相反，对细节的打磨使片子非常耐看，而且越看越迷人--细节的力量；我想象中只拍城市的杨德昌如果拍科幻题材就是这个样，一定会将无数理性问题荒诞化升至哲学角度去建构世界。', '神不神的不知道，以后这种跳出三界外不在五行中，只能靠榨取困意尿意转移到大脑里的意念去理解的所谓经典，再也不好奇了。猜到结尾必有回归母体表达无止境轮回的画面，所以看到的时候并没惊喜，光顾心疼我仅有的视力和本来敏锐的听力了。EVA部分不错。但没看明白之前三星到头了跟风吹牛逼我拒绝', '你敬畏，你惶恐，你疑惑，你通晓，你心中虚空无物，于是你洞悉万物，你穿越了轮回，终于也变成了轮回；如梦如幻，如痴如醉，堪称是自电影诞生以来，最伟大的奇观之一。又及：库布里克声音叙事的能力令人顶礼膜拜，重要性几乎与画面不相上下。', '2018年6月四刷；太空幽玄神秘、生命的神秘未知，瞠目结舌无法呼吸，已被吸进银幕黑洞。影史最有名的扔骨头蒙太奇，浑身一震的恢宏配乐，包裹在光环里的人类起源，鸡皮疙瘩直泛，库布里克绝对超一流恐怖大师，静默中蕴含的心理层面上的无限恐惧。探寻人类终极问题，从硬科幻上升到哲学命题。', '【库布里克回顾展2015/4/17】1.奇异旅程的炫目光影特效和古怪房间内的蒙太奇太震撼了。2.台词寥寥,不疾不徐,古典音乐与惊悚音效的搭配绝了。3.骨头-飞船动作匹配剪辑,魅惑黑石。4.HAL9000的悲歌。5.iPad与现代主义家具。6.人类进化,人性,宇宙奥秘,意识能量体,人工智能...引人深思的太多。（9.5/10）', '20131117中国电影资料馆米高梅影展修复版。 20190406北京国际电影节IMAX版。', '这里面有太多经典镜头了。我就像是一个飞船爱抚者。', '剧情节奏我是真受不住，直接快进，特效很给力，所以打四星，看完，对宇宙多了一份敬畏之心', '这片子浑身上下每个毛孔都散发着太空歌剧的味道', '第一部库布里克。A Space Odyssey，三段式讲出了人类文明史——人类的起源、文明时期对太空的探寻及科技对人的异化、轮回与升华。《查拉图斯特拉》和《蓝色多瑙河》的配乐。库布里克真正懂如何表现恐怖：无声而非音乐渲染、未知而非看见，因为这两者本质都出于认知能力的有限，人注定无法全知全能。', '不明觉厉的典型。话说那段穿越的特效必须得跟当年的嬉皮一样一遍抽大麻一遍看才能High啊!!!', '1968年的库布里克带着冷战阴影下的人们神游太空时，2018年的我们却要继续在这个无趣的世界里加速沉沦。2001都过去17年了，人类正活在电影先知般的预言中。最后那段嗑药飞升，是一曲永无休止的迷躁，是万物创世般的沧海一粟，浓缩了人类所有的伟大与无知。而宇宙，却永远暗黑，永远高冷。', '想体验“我看不太懂但是这电影太牛逼了”感觉的可以去看一下', '你要说它个人吧，其实它意图表达的东西是献给全人类的，可能要的就是这种似懂非懂、细思恐极的感觉。每一帧都很美，都像包含着无穷的意义，配乐更是点睛。不明觉厉的科幻片都是恐怖片啊。没什么语言可以形容，就是叹为观止。', '我又要冒天下之大不韪了。前2/3我尚能沉住气和无穷无尽却信息量极低的长镜头耐心周旋，但结果还是被最后20分钟的莫名其妙给彻底激怒了。至少在我看来，不加以过度诠释就无法理解的内容，我倾向于认为它不值得被咬牙诠释；换个主创的名字就会被视作一堆碎片的作品，我倾向于认为它本就是一堆碎片；不借助原著便无法自立的电影，我认为那就是失败的创作。我同样认为，电影史的地位高低问题，不应该被赋予太大的权重。因为归根结底，电影首先是用来观看和感受的，不是用来梳理和训诂的。更重要的是，我觉得真诚是一个人最重要的品质之一。于人于己都是如此。', '感谢库布里克拍出了这部电影，我永远的TOP1 ★★★★★ 10.0', '五十周年70毫米修复版，据说是最接近于1968年首映的修复版本。库布里克的女儿来了，还活着的主创制片也来了。甜茶等明星屁颠屁颠跑来当观众。戛纳电影节德彪西厅。#有生之年#', '看不懂的时候觉得不咋地，后来终于看懂了还是觉得不咋地，时代的眼泪啊换我在人类登月之前看到这片也会觉得了不起的。凡尔纳我从未觉得过时，原著真心二流科幻。库布里克的表现手法也许很牛，可惜不是我的菜。']","['https://img9.doubanio.com/view/photo/m/public/p2560717825.jpg', 'https://img2.doubanio.com/view/photo/m/public/p2517680701.jpg', 'https://img9.doubanio.com/view/photo/m/public/p2523911744.jpg', 'https://img1.doubanio.com/view/photo/m/public/p2493796278.jpg', 'https://img2.doubanio.com/view/photo/m/public/p792191732.jpg']",./data1/post_video/斯坦利·库布里克/2001太空漫游 2001 A Space Odyssey/image,"['https://img1.doubanio.com/view/photo/sqxs/public/p937466507.jpg', 'https://img2.doubanio.com/view/photo/sqxs/public/p2552008653.jpg', 'https://img2.doubanio.com/view/photo/sqxs/public/p453483431.jpg', 'https://img9.doubanio.com/view/photo/sqxs/public/p937469514.jpg', 'https://img2.doubanio.com/view/photo/sqxs/public/p2572196553.jpg']",./data1/post_video/斯坦利·库布里克/2001太空漫游 2001 A Space Odyssey/image,"['https://vt1.doubanio.com/202204301946/1e04398b2f90112bd68b03f76c16fca7/view/movie/M/402300949.mp4', 'https://vt1.doubanio.com/202204301946/900ea4eb65f269d9d9bfe6f01ab06d2b/view/movie/M/402300543.mp4', 'https://vt1.doubanio.com/202204301947/890ef823cf5e45259ed6d68412b71b18/view/movie/M/402290422.mp4', 'https://vt1.doubanio.com/202204301947/f46bf6fdb974ccd50cf89b8031c488ce/view/movie/M/301300679.mp4']",./data1/post_video/斯坦利·库布里克/2001太空漫游 2001 A Space Odyssey/video
闪灵 The Shining,https://movie.douban.com/subject/1292225/,斯坦利·库布里克,斯坦利·库布里克/黛安·约翰逊/斯蒂芬·金,"['杰克·尼科尔森', '谢莉·杜瓦尔', '丹尼·劳埃德', '斯加特曼·克罗索斯', '巴瑞·尼尔森']",8.3,444695,好于99%恐怖片,恐怖,英国/美国,英语,1980-05-23(美国),119分钟(欧洲版),杰克（杰克•尼科尔森 Jack Nicholson 饰）是一个作家。一个冬天，他得到了一个看管山顶酒店的差事。这正合杰克的意思，他正好可以有一个幽静的地方写作。于是杰克带着妻儿搬进了酒店。冬天大雪封路，山顶酒店只有杰克一家三口。从他们一搬进来，杰克的妻子温蒂（谢莉·杜瓦尔 Shelley Duvall 饰）就发现这里气氛诡异，杰克的儿子丹尼（丹尼·劳埃德 Danny Lloyd 饰）经常看到一些他不认识的人，但这里除了他们一家别无他人。而杰克除了一整天闷头写作外，脾气亦变得越来越古怪。直到有一天，温蒂发现丈夫这些天来一直写就只有一句话：杰克发疯了！,INF,[],"['https://img2.doubanio.com/view/photo/m/public/p2461253191.jpg', 'https://img9.doubanio.com/view/photo/m/public/p1458619344.jpg', 'https://img9.doubanio.com/view/photo/m/public/p1458622086.jpg', 'https://img1.doubanio.com/view/photo/m/public/p2589132869.jpg', 'https://img2.doubanio.com/view/photo/m/public/p2633511381.jpg']",./data1/post_video/斯坦利·库布里克/闪灵 The Shining/image,"['https://img2.doubanio.com/view/photo/sqxs/public/p2565660403.jpg', 'https://img9.doubanio.com/view/photo/sqxs/public/p1780794615.jpg', 'https://img1.doubanio.com/view/photo/sqxs/public/p2191851818.jpg', 'https://img9.doubanio.com/view/photo/sqxs/public/p1297759064.jpg', 'https://img2.doubanio.com/view/photo/sqxs/public/p2276370733.jpg']",./data1/post_video/斯坦利·库布里克/闪灵 The Shining/image,"['https://vt1.doubanio.com/202204301948/e1c881ec2ab4fbd87e270394a2ad6b8e/view/movie/M/302030966.mp4', 'https://vt1.doubanio.com/202204301949/c5114148154111cff84744ffd1ca6b46/view/movie/M/301240281.mp4']",./data1/post_video/斯坦利·库布里克/闪灵 The Shining/video
