电影名,电影网址,导演,编剧,主演,评分,评分人数,评分额外信息,类型,制片国家/地区,语言,上映时间,时长,剧情简介,获奖情况,热门评论,海报链接,海报保存路径,剧照链接,剧照保存路径,视频链接,视频保存路径
艾米莉亚 Amelia,https://movie.douban.com/subject/3010407/,米拉·奈尔,SusanButler/MaryLovell,"['希拉里·斯万克', '伊万·麦克格雷格', '理查·基尔', '克里斯托弗·埃克莱斯顿', '乔·安德森']",6.3,1221,"好于8%传记片,好于29%冒险片",剧情/爱情/传记/冒险,美国/加拿大,英语,2009-10-23,111 分钟,“Amelia”讲述的是美国女飞行员Amelia Earhart的传奇人生，标准的人物传记片，美国式立志奋斗故事，再加上女主角是希拉里.斯旺克，明显有瞄准奥斯卡之嫌。看新闻里的介绍：伊万演的是Amelia的真爱，一个叫Eugene Luther Vidal的西点空军飞行员，好像在美国历史上还挺有名的；片中另外一个男主是理查.基尔，饰演Amelia的丈夫。,INF,"['斯万克也有演这破片的时候', '不知道，Hilary Swank是总攻。我就是喜欢总攻的故事！！！', '这种失真的传记片可以休矣，白费了希拉里斯旺克', '绝对算是大牌云集的一部电影~~~ 可惜因为题材本身的问题 一直都不想看~~~ 电影本身很无趣 就当时看了一个故事好了 向这位女士致敬', '【艾米利亚】在视听、导演和表演方面都是奥斯卡级别的，它的失败在于剧本改编上。 三星', '看到最后竟然哭了。没想到这部本来都不怎么想看的片子教会我很多。', '更适合美国人看', '太一般了，励志吗？感怀吗？追忆吗？哪个都没说透，平淡如水，浪费了这么好的演员，还与原型那么相似！', '没有想象中那么糟 但也没有应有得那么好', '传记片有很多种，大概有两类，强调剧情的起承转合的外在方面以及强调事件（和剧情不同）以及人物的心理变化等内在方面。一部电影不会同时具有这两个特点，因为它们是根本矛盾的。前者可看性固然更高，但是拍得再好也有限。这部电影就是属于前者，而且是前者中平庸的作品，甚至就可以当爱情片看', '李察·基尔好帥~', '騷娟也無法拯救你。', '风一样的T娃儿', '无趣', '小男配Ewan', 'Great costume!', '结局有点悲伤~！', '李察大叔，您还是很赞哪！', '为毛伊万戏份那么少还是个小三？', '造型不错', '够传记', '独白很美。', '希拉里·斯万克主演的美国历史上“最具才华、最有建树和最勇敢的女飞行家艾米莉亚”传记片，还可以，不知道为什么IMDB得分那么低呢？', '励志得出戏', '剪接你可以去死了', '没期待过它会好看', '有形无神～', '三大牌的表演十分精彩 很想多给些分 但剧本设置也确实让人提不起精神 而最终的悲剧也是在之前就埋下了深深的伏笔 让人感到由始至终的沉痛与惋惜 如果作为励志片来要求的话确实只能给还行了 音乐还不错 纠结纠结还是给4星吧', '伟大的传奇女性又一次被大荧幕诠释，值得褒奖', '虽然剧情不算吸引人，总算是励志，女性们看看是好的', 'Hilary实在太丑了', '本有大片气质，可惜剧本单薄', '妈的，还这么长', '浓缩了09年好莱坞电影令人失望的特点，毫无气质可言。藏独分子Richard Gere你每天要吃几斤的胎盘来保护你那粉嫩的老脸？', '萌神是最大的看点~~~><', '没意思', 'tragedy', '斯萬克阿姨還是不要笑了吧。麥克格雷先生的戲貌似我都睡過去了。', '美國傳奇女飛行家艾米莉亞在她人生最後一次飛行中回顧她的一生。Mira Nair導演怎麼說都拿過金獅獎，但本片實在是令人失望，當然主要責任並不在她，應該拖出去拿門夾腦的是編劇，傳記片不是一味的炫耀主人公的輝煌，也需要展現她足夠的失敗，而影片感情戲部份的寡淡更是令人徹底放棄本片。', '只做乘客还好意思拍出来。标准的美国电影。', '很一般的传记片，着墨太多在于Amelia的成就，只是一次次的镜头转换，却没有她或他内心的挣扎抉择，总之很有形无神。', '艾米莉亚的意义绝对不仅仅在女权，而且，对于成功人物，人们不只是喜欢他们成功的那一刻。', '哎哟 两个演员看得难受', '困境刻画反而看上去并不困难，这部分问题明显。', '题材本身是富有感染力的，但作为一部传记片，影片对于人物的性格和心理的展现都流于表面，演员也没有什么可发挥的空间，缺乏打动人的力量。ewan的戏份比我想象中还要少得多。', '除了高空俯瞰的几个美景，不管是情感还是励志都完全没有动人之处，极其失败的传记片。', '其实只拍飞机滑翔的镜头就行了', '最不适合拍出来的传记片。。。一点张力都没有。', '2011.09.11 @ Home 大腕们 真的太无聊了吖', '更喜欢《博物馆惊魂夜2》里的艾米利亚，作为一部流水账般的传记片还没有她每次出场的丝巾闪亮，飞行服确实很帅！']","['https://img9.doubanio.com/view/photo/m/public/p949861815.jpg', 'https://img3.doubanio.com/view/photo/m/public/p949863170.jpg', 'https://img9.doubanio.com/view/photo/m/public/p844685524.jpg', 'https://img2.doubanio.com/view/photo/m/public/p2524403622.jpg', 'https://img1.doubanio.com/view/photo/m/public/p844685817.jpg']",./data1/post_video/米拉·奈尔/艾米莉亚 Amelia/image,"['https://img3.doubanio.com/view/photo/sqxs/public/p844685290.jpg', 'https://img2.doubanio.com/view/photo/sqxs/public/p1012931332.jpg', 'https://img2.doubanio.com/view/photo/sqxs/public/p456301293.jpg', 'https://img9.doubanio.com/view/photo/sqxs/public/p456301275.jpg', 'https://img1.doubanio.com/view/photo/sqxs/public/p456301219.jpg']",./data1/post_video/米拉·奈尔/艾米莉亚 Amelia/image,['https://vt1.doubanio.com/202204281230/b7d85a4f78ee9fce318ec1d01bbe6274/view/movie/M/301210990.mp4'],./data1/post_video/米拉·奈尔/艾米莉亚 Amelia/video
如意郎君 A Suitable Boy,https://movie.douban.com/subject/27038855/,米拉·奈尔,安德鲁·戴维斯/维克拉姆·塞斯,"['坦娅·曼尼克塔拉', '艾萨·安哈尔', '维维克·贡贝尔', '莎哈娜·高斯瓦米', '米哈伊尔·森']",7.4,298,INF,剧情,英国/印度,英语,2020-07-26(英国),INF,故事发生在1951年的印度北部，Lata不愿向姐姐一样走向传统包办婚姻的人生道路。面对三个截然不同的追求者，她在家庭责任和浪漫刺激之间徘徊，踏上了爱情、欲望和心痛的史诗之旅。她的选择将在印度第一次独立大选的政治背景下展开。,INF,[],"['https://img1.doubanio.com/view/photo/m/public/p2623938398.jpg', 'https://img2.doubanio.com/view/photo/m/public/p2615285761.jpg', 'https://img3.doubanio.com/view/photo/m/public/p2615285760.jpg']",./data1/post_video/米拉·奈尔/如意郎君 A Suitable Boy/image,"['https://img9.doubanio.com/view/photo/sqxs/public/p2619144416.jpg', 'https://img1.doubanio.com/view/photo/sqxs/public/p2615075728.jpg', 'https://img9.doubanio.com/view/photo/sqxs/public/p2575815516.jpg', 'https://img2.doubanio.com/view/photo/sqxs/public/p2619144421.jpg', 'https://img3.doubanio.com/view/photo/sqxs/public/p2619144420.jpg']",./data1/post_video/米拉·奈尔/如意郎君 A Suitable Boy/image,['https://vt1.doubanio.com/202204281232/7b2a3e3cbed14c564feb2cb89676cc35/view/movie/M/402630418.mp4'],./data1/post_video/米拉·奈尔/如意郎君 A Suitable Boy/video
密西西比风情画 Mississippi Masala,https://movie.douban.com/subject/1297483/,米拉·奈尔,苏妮·塔拉普莱瓦拉,"['丹泽尔·华盛顿', '萨莉塔·乔德霍里', '罗珊·塞斯', '查尔斯·达顿']",6.9,140,INF,剧情/喜剧/爱情,英国/美国,英语,1991-09-18,118 分钟,洁伊是住在非洲37年的印度人，从小就和非洲黑人奥起洛是很好的朋友，有一天非洲政策改变，驱逐这些亚洲人离开他们的第二个故乡。80年代接续在密西西比小城镇，长大的咪娜喜欢上自力更生的黑人狄米契，对于同为有色人种成 人社会的禁忌不去在乎，但是他们的爱情却要面对现实考验。,"['主竞赛单元 金狮奖 (提名)', '金奥赛拉奖 最佳编剧']",[],"['https://img1.doubanio.com/view/photo/m/public/p2871926098.jpg', 'https://img9.doubanio.com/view/photo/m/public/p2576467045.jpg', 'https://img1.doubanio.com/view/photo/m/public/p2576467027.jpg', 'https://img1.doubanio.com/view/photo/m/public/p2265474767.jpg', 'https://img9.doubanio.com/view/photo/m/public/p2265474764.jpg']",./data1/post_video/米拉·奈尔/密西西比风情画 Mississippi Masala/image,"['https://img2.doubanio.com/view/photo/sqxs/public/p2871926473.jpg', 'https://img2.doubanio.com/view/photo/sqxs/public/p2871926472.jpg', 'https://img2.doubanio.com/view/photo/sqxs/public/p2871926471.jpg', 'https://img3.doubanio.com/view/photo/sqxs/public/p2871926470.jpg']",./data1/post_video/米拉·奈尔/密西西比风情画 Mississippi Masala/image,[],./data1/post_video/米拉·奈尔/密西西比风情画 Mississippi Masala/video
神经性失明 Hysterical Blindness,https://movie.douban.com/subject/1308149/,米拉·奈尔,LauraCahill,"['乌玛·瑟曼', '朱丽叶特·刘易斯', '吉娜·罗兰兹']",7.1,99,INF,剧情,美国,英语,2002-01-16,99分钟,兩位要好的朋友Debbie和Beth，他們都已逼近30，仍是單身，因此都十分惶恐的急著追求真愛。但似乎找錯了地方，她們每天晚上都窩在Ollie’s這間兩人最常來的酒吧，希望找到Mr. Right。同樣是藍領階級，Debbie較有主見，而Beth是位單親媽媽，限制了她在追求愛情上的選擇。Debbie的母親Virginia也有她個人的困擾，她對正與自己交往的喪偶男士間的關係感到懷疑。當這些女人主動積極的追求愛情，到頭來卻發現這只是一場褪色的夢時，她們必須走過過去的”瘋狂的盲目”，學會以重新的態度來看待自己。,"['电视类 限定剧/电视电影最佳女主角', '电视类 最佳女配角(提名)']",[],['https://img2.doubanio.com/view/photo/m/public/p2203674063.jpg'],./data1/post_video/米拉·奈尔/神经性失明 Hysterical Blindness/image,[],./data1/post_video/米拉·奈尔/神经性失明 Hysterical Blindness/image,[],./data1/post_video/米拉·奈尔/神经性失明 Hysterical Blindness/video
旧爱新欢一家亲 The Perez Family,https://movie.douban.com/subject/1306836/,米拉·奈尔,罗宾·史威考德,"['玛丽莎·托梅', '阿尔弗雷德·莫里纳', '安杰丽卡·休斯顿']",7.2,76,INF,剧情/喜剧/爱情,美国,英语,1995-05-12,113 分钟(英国),"2001年的威尼斯电影节上，印度女导演米拉．奈尔（Mira Nair）开始为世界影坛关注，她的《季风婚宴》获得了金狮大奖。米拉．奈尔早年以《早安孟买》成名，并拍摄了我们熟悉的《爱经》等作品。《男人最疼》（The Perez Family）是她1995年一部通过古巴流亡移民的题材，描写自由、家庭与爱情的影片。男主人公浩安．帕莱兹从古巴来到美国，想在""自由国土""上找到自己原有的家庭。但为了对付移民局的检查，他又不得不""组成""另一个""临时家庭""，先是风骚、热情的女郎杜蒂做妻子，又找来也姓帕莱兹的疯癫老人做父亲，以及""失散多年""的""儿子""。影像中仿佛透出奈尔柔软的目光，故事在温暖的情调中结束……",INF,[],['https://img1.doubanio.com/view/photo/m/public/p2461649599.jpg'],./data1/post_video/米拉·奈尔/旧爱新欢一家亲 The Perez Family/image,"['https://img3.doubanio.com/view/photo/sqxs/public/p2577823130.jpg', 'https://img1.doubanio.com/view/photo/sqxs/public/p2577823127.jpg', 'https://img9.doubanio.com/view/photo/sqxs/public/p2577823126.jpg', 'https://img9.doubanio.com/view/photo/sqxs/public/p2577823125.jpg', 'https://img2.doubanio.com/view/photo/sqxs/public/p2577823123.jpg']",./data1/post_video/米拉·奈尔/旧爱新欢一家亲 The Perez Family/image,[],./data1/post_video/米拉·奈尔/旧爱新欢一家亲 The Perez Family/video
