电影名,电影网址,导演,编剧,主演,评分,评分人数,评分额外信息,类型,制片国家/地区,语言,上映时间,时长,剧情简介,获奖情况,热门评论,海报链接,海报保存路径,剧照链接,剧照保存路径,视频链接,视频保存路径
早安孟买 Salaam Bombay!,https://movie.douban.com/subject/1303051/,米拉·奈尔,米拉·奈尔/SooniTaraporevala,"['沙菲克·赛义德', 'IrfanKhan', 'ChandrashekharNaidu']",8.3,686,好于91%犯罪片,剧情/犯罪,英国/印度/法国,印地语/英语,1988-09-13,113 分钟,INF,"['最佳外语片(提名)', '金摄影机奖（导演处女作奖）', 'Audience Award']","['印度电影中难得的非娱乐片。 发展中国家都有同样的问题，警察无良。 从印度看，中国的计划生育政策至少使中国的文盲率较低，街头少年较少。', '彩色版阿普三部曲，现实版贫民窟的百万富翁，影片风格近于纪录片，对于80年代孟买街头的描述异常真实醒目，甚至逼于残酷。流浪儿童，小老板，妓女，妓女的女儿，皮条客，警察，嫖客，人贩子，形形色色的人物在世俗的嬉笑怒骂中卷入现实的旋窝，下降，沉没，挣扎，寂静无声。茶冷心凉，观之悲矣。。。', '非常牛逼，超简练的笔法描绘出超级生动的人物群像和复杂的底层生态。愈是深陷泥涝里的温情愈令人动容，愈是血污里迸发的幽默欢乐愈令人感伤。自己被抛弃到大街上，却还一直要救人。救小妓女，救“哥哥”，救小妹妹，救妓女妈妈，但谁也救不了，更救不了自己。开场曲是有着印度风味的八九十年代强力迪斯科，高调拉开序幕，结局在象神节的喧嚣中反倒劈出一片寂静，失去了一切的街童在寂静中尽情哭泣，紧接着又是坚强倔强的神情缓缓流露。片中人说小孩子可怜不懂事，渴望回到被虐待的家庭中去，我们的小街童又何尝不是，永远无法攒够的500卢比代表对自己紧闭的家门，乘以二十则是梦中新娘初夜的标价。女性导演对孩子们细腻的描摹神乎其神。稍微美中不足的是正邪对立有点简单。', '对底层，特别是孩子们的刻画是非常写实的。本片中家庭退化到近乎原始的状态，失去了完全的庇护作用，承担家庭责任的人和朋友变成了背叛者和寄生虫。最后在爱情湮灭失去一切的情况下，男孩会不会成为下一个抛弃一切的人。何以为家2.0', '印度断根电影……', '""How can the state be her mother?""', '几乎是折磨，我受不了影片的残酷。innocent nepal girl believe in pimp‘ love。manju escape from the chiller room。prostitute lose the custody of her girl。', '孟买贫民区残酷生活实录。导演米拉·奈儿毕业于哈佛大学，七十年代末开始执导纪录片，这部处女作完成于1988年，手法相当成熟。和同时期本土导演相比，米拉·奈儿的视角具有西方或者说是局外人色彩，即能够直面印度令人绝望的恶劣生存环境。她也有意识摒弃人们对印度电影的刻板印象，不拍摄一场歌舞戏，连音乐都很少使用。脏乱的街道里，以几个流浪儿和一家妓院的生存景象折射贫困的现实。一个被赶出家的少年意外流浪到孟买，遇到被卖进妓院不懂印地语的少女。他同情少女，想救她出去，但最终只能眼巴巴看着她被骗为娼。他为挣到回家的500卢比而辛勤工作，留宿街头。肮脏混乱的贫民区毁了他的希望，他的愤怒转化为一瞬的暴力。他淹没在节日庆祝的人群里，被人推搡着失去方向，最后一个人坐在空荡荡的街道哭泣。', '作为上流精英的米拉·奈尔对印度底层社会的呈现犀利而富洞察力，那个贫穷落后、肮脏混乱的孟买第一次震撼了西方社会。实景拍摄是为了最大限度的呈现孟买当时的社会景象：随处可见的妓院，毒贩和流浪儿童。苦难深深地烙印在他们身上，小小年纪却经历了生活的残忍和罪恶。真实的影像再一次彰显了纪实美学的力度，它向我们证明：现实主义作为一种创作态度永远不会过时。', '苦难的底层群像，沉沦，抗争，麻木，绝望…', '只有儿童以灵动的生命扑腾这片斑斓的世界之海`多舛的命运 `荒诞的色彩 喷薄而出 光明而合理 花火一般无声凄美的短暂童年', '31岁的导演，流浪儿童，像极了天使之城，只是没那么暴力，最让人痛心之处在于，我观察，我拍摄，我却无法改变，无能为力，谁来做些什么呢', 'world cinema 作业。"" We are the flowers never bloom. "" 之后还特意刷了一下 Monsoon Wedding 的几个长镜头。', '即使是现代化如何发展演变，城市化进程如何日新月异，从早安孟买到贫民窟的百万富翁，孟买十几二十年，甚至是三十多年一直都没变的就是这混杂着梦想憧憬和野心，思乡情怯和人情冷暖，底层生活的生存博弈和残酷。沦陷在爱情谎言里遂向现实妥协的Sweet Sixteen，怀揣着归家之心沦落到从少管所脱逃的男孩，迷失在人群中的妓女和她被迫离开的家和女儿，象神节上的拥挤狂欢，庆祝着Ganesh的无边神力，相形之下是孟买街头小人物自己都无从掌控的命运。', '比迦百侬高出许多', '2004年10月8日 沽上暖阁 底层社会孩子的掠影', '故事是相对绝望的，只能说一地鸡毛，影片镜头频繁的拍摄各个公共场景，马路、大街、火车站，可以见得印度当时整个环境是多混乱。', '悲剧丛生，无处安放', 'ic18辛酸与愤怒，反思中又加强了精神洁癖。少看。“André Bazin and the Tradition of Realism” 第三世界缩影，我们也不过领先一截而已。贫穷让儿童那双纯真的眼神充满了老成，与steveMcr拍的惶恐少女像同出一辙。', '“One day in our india, things will be all right.”对现实的愤怒和无奈转化为捅向权利化身的一刀，结尾的哭泣的渐渐停止也许是导演对印度社会问题的拷问。PS：在里面发现了中年Pi。', '印度苦逼孩子', '我看过最好的印度电影（雷伊的还没有开始看），在这部面前，贫民窟百万富翁，阿米尔汗的那些，都平庸了起来。现实主义果然是我这段时间最爱的风格，那些孩童的表演，太尼玛直达内心了，32年过去了，街上的流浪儿，还在赚500卢比吗？', '印度，孟买，贫民窟一角，这里同世界上其它的贫民窟并无两样，充斥着性、暴力、毒品，蚁居在这里的，都是被上帝遗弃的子民。本片是少有的关注社会底层的印度片，没有歌舞升平，只有昏暗、杂乱与绝望。', '真实的印度，社会的阴暗面，老师说这样的电影就像在扇自己的巴掌。课堂放映，第一排男生的头老是挡到我。气。', '作为不了解印度社会和印度电影的人，这部面向西方观众的现实主义电影完全契合我对“印度”的刻板印象。三十年过去了，不知孟买的混乱与贫困是否发生了大幅改变。', '发现孟买这些年的变化居然不是很大，有意思！', '佛祖之城…除了很多较为普世的议题，童工和儿童福利问题比较直接和突出，现在的印度怎么样了？不知道有哪些非虚构作品值得一读。好的电影就像一面镜子让人反思自己，我有机会也一定要为我的同胞做些什么', '为什么有的人一出生就注定是绝望的', ""I don't like dealing with realism!"", '1-12 我亲爱的孟买啊', '高清就是好。孟买作为大城市看着也很不咋地啊！', '印度人真的是...', '40m', '没有正确的憎恨对象是最惨的吧', '一个归家不得的孩子的故事。觉得吸引力一部分只来自于神秘感…', '这片双段型叙事，前面滴部分还觉得有点点无聊。可当正太男主滴好机油被BABA扫地出门并扑街后，整部电影滴基调才180°大转弯，变得比较晦暗起来。最后正太万念俱灰一边缠陀螺一边哭滴这段处理得非常棒！不过说真滴，这仅仅只素冰山一角，妓女的荣耀这片里孟加拉那段更凄惨惊心。。。毕竟别人素纪录片=w=', '在纯真无暇的时光沾染牛马气息 在吞云吐雾中体验醉生梦死 在甜蜜的十六岁品尝苦涩眼泪 在皮肉勾当里汲取母性力量 在孟买的每一个清晨与梦中的生活道晚安', '苦逼阿三娃攒钱赎身娶媳妇回老家', '生存，挣扎。', '人间地狱吗？米拉·奈尔相较其他导演来好莱坞发展的结果。李安的成就彌足珍贵。', '看完电影，身边的白人阿姨跟朋友说，我都不知道为啥我对生活有这么多抱怨。故事超有张力，流浪的tea boy，阁楼上的妓女，拉皮条的毒贩，每个人都真实合理。生命是一出悲剧，但你却可以看到他们浓烈的改变生活的态度和行动。而人和人之间的爱护终究是相通的，所以我和他一样。', '悲情孟买，色彩纷繁的底层社会生活群像，这部处女作大概是米拉奈尔最好的电影', ""孟买小瘪三的世界其实也没什么绝望的，就是让我们知道人可以有各种生存方式罢了，有点好似印度版的“活着”吧。。。瘾君子Chillum死后小瘪三们为他募捐然后抬着他的尸体做简单的仪式一路喊着Ram ka naam satya hai (Truth is God's name)! 。。。而去，情状还是很感人的。"", '因为太过真实，越发让人感到绝望，这让人无法逃离的痛苦生活。', '胆大心细。高昂着脖颈，匍匐前进', 'for all the street boys', 'mark那么多年的电影终于看掉了。', '各种无良之下，谈何生存，谈何梦想，谈何自由。', '21/8/1：无懈可击', '生活很艰辛']","['https://img9.doubanio.com/view/photo/m/public/p2677756056.jpg', 'https://img1.doubanio.com/view/photo/m/public/p2428848287.jpg', 'https://img9.doubanio.com/view/photo/m/public/p2428848285.jpg', 'https://img9.doubanio.com/view/photo/m/public/p2428848284.jpg', 'https://img2.doubanio.com/view/photo/m/public/p2867436041.jpg']",./data1/post_video/米拉·奈尔/早安孟买 Salaam Bombay/image,"['https://img1.doubanio.com/view/photo/sqxs/public/p2558155057.jpg', 'https://img9.doubanio.com/view/photo/sqxs/public/p2558155056.jpg', 'https://img2.doubanio.com/view/photo/sqxs/public/p2666531082.jpg', 'https://img9.doubanio.com/view/photo/sqxs/public/p2558155054.jpg', 'https://img2.doubanio.com/view/photo/sqxs/public/p2558155053.jpg']",./data1/post_video/米拉·奈尔/早安孟买 Salaam Bombay/image,[],./data1/post_video/米拉·奈尔/早安孟买 Salaam Bombay/video
欲望和智慧 Kama Sutra: A Tale of Love,https://movie.douban.com/subject/1294253/,米拉·奈尔,HelenaKriel/米拉·奈尔/WajidaTabassuh,"['纳威恩·安德利维斯', '因迪拉·瓦玛', '萨莉塔·乔德霍里', '拉蒙·蒂卡拉姆']",6.7,2537,"好于38%爱情片,好于40%犯罪片",剧情/爱情/历史/犯罪,英国/印度/美国/德国/日本,英语/意大利语,1996-09-11(多伦多电影节),117 分钟,INF,INF,"['很久之前看的，我一定要说，这不是情色电影，真的是一部很好看很好看的近乎文艺片的电影了。', '符合我认同的智慧，通过欲望可以完美爱情。片子还是有些解构和细节没处理好，起承转合间觉得牵强。', '果然一群叉人可以起到瞬间让人失去性致的效果', '这片子唯一和爱经贴切的地方就是王子洞房时逗弄公主Tara的那些话，基本照搬爱经中“如何干你的处女老婆”指南。韶华已逝的Rekha依旧比骨架子超大的Indira Varma更富“印度女子”的韵味（Indira Varma后来去演罗马女人，合适多了）。整个片子有G点无亮点。', '「爱经」本意似乎为了让男女和谐与平衡，却被男权社会变异成女性讨好男性的手段，女性导演对此要么转化成性别战争的檄文，要么就成为如本片充满「女性物化」的叙述中，最后让位于庸俗的「谈情说爱」与宿命。', '印度爱经Kama Sutra。爱不是失去自己。”片中教授爱经的哈莎这样说：爱的最高境界，就是将肉欲升华到绝对的信任，二者合二为一。但影片中，玛雅赢得贾谷马的爱情，仅纯粹自然，而爱经也没有能让玛雅和王子之间升华出爱情。爱经依然是传授种种取悦男人的技巧和手段，这个观点在片中不止一次地', ""it's a love story,a beautiful one"", '有大量奇观的营造，虽然性爱场面的描写对90年代的欧美观众来说已经习以为常，但发生在印度古国这样充满着神秘元素的地域，仿佛就能够御风而上，更来得强劲。这种直接的场面是对印度女性被囚禁现状的释放，但在奇观化之下又被消解了部分力量。然后，最重要的是：性和爱之间有转化吗？你如何爱上一个人而不仅停留在性上？更多的是对结果的告诉，而不是过程。', 'VCD还有呢，我就DVD也收也看，这不连BD蓝光我都收藏一张，看过也留着吧', '大学时女生一起围观的电影。', '衣服好简单 好好玩啊 挺漂亮的 我也想穿纱丽 叮叮当当的', '不知道怎么说了，如果这都能代表女性形象的话，那真是腐朽落后的女性形象了。全是迎合屈服以色侍男人的女性嘴脸，身材将就，长得如此秋的脸也没多大看的了。', '好难看的公主啊。。。男主，当年年轻的萨伊德童鞋，好惊。。。', '亲娘类…能把情色片拍得这么不情色这么闷也是需要水平的…除了服装发型、风景音乐有些看点外没啥了…卧槽故事情节天雷狗血的一逼啊【抱歉我粗糙了…', '取了“爱经”这样一个大的名头。直让大部分人不由得不期待和想多些。到最后，其实，所有看似讲性的，到最后讲的却是爱。讨论的也还是灵与肉的那一些问题。', '1998年 独立精神奖(Independent Spirit Award) 最佳摄影 Declan Quinn 1996年 圣塞巴斯蒂安国际电影节 Golden Seashell(提名) 米拉·奈尔', '小时候我们学骑自行车，长大了学开车。如同我们学习make love 的技巧，都应该是使事情变得更美好，或许不是时时刻刻在运用这个技巧，但至少应该先要学会，才有资格评说生命的宽广意义。其他的梦想与目标同是。', '太惊艳了，简直是印度版的西西里的美丽传说！', '只见欲望，不见智慧。。。', '明白爱，我能看淡万事。', '片子名字是《爱经》。开始对印度有点兴趣了。也只有如此尽致用力地经历过，才能全心出家啊。我等皆逊在经历不够、生活得不够深入。情欲+印度文化(性爱诠释+人文地理+建筑+雕塑+服装+妆容+日常细节)+人性刻画(尤其男女之间，很深刻)', '也是一位大姐姐监督我看得。。。', '男主不愧为自由石匠 殖民地就是殖民地 阿三不愧为阿三 将现实幻想成天堂 意淫于其中几千年 喜马拉雅之南用天地之始至终之间的全部精华滋养出了释迦摩尼 之前之后所谓的恬淡安逸都是伪命题 被标题骗了 这么深刻的题目拍成了故事片 让印度人说些白皮人从各处拼吧拼吧来的舶来品就敢讨论欲望与智慧？', '性的毁灭能力～画面很有美感～', '“性是一门重要的功课，值得一生去研究。”若中国的性教育也这样想，恐怕会有效的降低性犯罪率。', '啊，罗马里的Indira Varma原来早期就拍了部这样的电影', '2。印度还是拍不出情色片', '情色片最大的失败当属要色无色，要情无情。 色，自然是情色片的应有之义。如果没有色，还叫什么情色片呢。就像鸡蛋炒饭里面不放鸡蛋一样，叫人窝火不窝火。', '故事比较傻', '拍于克久拉霍和斋浦尔琥珀宫', '这是大概一年前魏巍跟我说过的片子，偶然找到在线，看完了，心里各种感慨说不出。爱真是世界上最复杂的事，也只有自己恋爱后才能看懂电影里的故事。印度有专门教授爱经的老师，我想我们也需要学习。', 'My heart is as open as the sky. Knowing love, I will allow all things to come and go.', '5分。负笈归来的米拉·奈尔美则美矣，她的印度仍是中规中矩的风情画（相比伊朗女导演激进的自我意识很难不失望）。按部就班卖妖娆翻拍，感情戏比《季风婚礼》还弱，情色也鸡肋，既无欲望也不智慧，看看舞蹈美人算数。待补《早安孟买》。', '情节老套，基本不具可看性。', '拍的好国际化，主要是因为讲英语，还不错，所有厉害的女人都叛逆或者曾经叛逆，这里面只有在发现偷情后才残酷，鸠占鹊巢都没被杀。印度少有情色片，以前连接吻都没有，这个很大胆', '女主好耐看，一查发现混了瑞士血。', '其实这部电影讨论的是很严肃的爱情问题，而且还很悲伤。你可以因为色情的原因而观看，但如果看完了仍然满脑袋色情，这就不对了。', '其实一点也不色。', '初中那会在黑网吧看的~咳咳', '风光旖旎，男女主角真心是漂亮人儿。故事是曲折好看的，但并不打动人心，最后女主角独行的背影消失在人海中，倒是那种经历了爱恨情仇过后的洒脱出世。', 'eat meat, ride meat, put meat into meat.', '什么印度姿势大全，也不咋地', '值得称赞的就只有摄影与服装', '女主挺好看的。。。男主我觉得像陈坤。。。哈哈哈哈哈', '明白爱，我能看淡一切。凡是如风，我有勇气面对一切。生命总有其道理，我的心宽广如天。', '欲望有余 智慧不足。', '黑不溜秋', '这部奇怪的片子，告诉我，除了男女主角的脸长得好看好剩下什么', '看了一半卡了~~ 玛雅好漂亮', '配乐的Mychael Danna老师玩得可过瘾。']","['https://img1.doubanio.com/view/photo/m/public/p2196650467.jpg', 'https://img1.doubanio.com/view/photo/m/public/p2536866619.jpg', 'https://img9.doubanio.com/view/photo/m/public/p2536866615.jpg', 'https://img2.doubanio.com/view/photo/m/public/p2536866612.jpg', 'https://img2.doubanio.com/view/photo/m/public/p2457816802.jpg']",./data1/post_video/米拉·奈尔/欲望和智慧 Kama Sutra A Tale of Love/image,"['https://img2.doubanio.com/view/photo/sqxs/public/p817072253.jpg', 'https://img2.doubanio.com/view/photo/sqxs/public/p2160995823.jpg', 'https://img1.doubanio.com/view/photo/sqxs/public/p1400946557.jpg', 'https://img1.doubanio.com/view/photo/sqxs/public/p1400946539.jpg', 'https://img1.doubanio.com/view/photo/sqxs/public/p1400946508.jpg']",./data1/post_video/米拉·奈尔/欲望和智慧 Kama Sutra A Tale of Love/image,[],./data1/post_video/米拉·奈尔/欲望和智慧 Kama Sutra A Tale of Love/video
名利场 Vanity Fair,https://movie.douban.com/subject/1309173/,米拉·奈尔,马修·富尔克/MarkSkeet/朱利安·费罗斯/威廉·萨克雷,"['瑞茜·威瑟斯彭', '乔纳森·莱斯·梅耶斯', '加布里埃尔·伯恩', '安吉拉珂·曼蒂', '罗格·洛伊德-派克']",6.9,13705,好于29%剧情片,剧情,美国/英国/印度,英语/法语/德语,2004-09-01,141分钟,INF,['主竞赛单元 金狮奖 (提名)'],"['女主角的表演真的是上乘,但是我很是受不了导演,貌似是印度裔的.但你导演是印度的我当然不反对,可你也不用再影片中处处表现出来吧……就好像由李安来拍断背也不用让Jake和Heath穿上唐装一样.', '浮华有余，讽刺不足，结尾大团圆是致命败笔。', '萨克雷。', '怀孕的她还是那么完美！', '这样坚强，乐观，生命力顽强，不怕伤害的女人，应该得到好的人生。爱与善良并不只在淑女和贞洁名下。', 'Becky Sharp被塑造得过于可爱，野心不足，丑陋不够；结尾更是狗血，硬把一个讽刺小说改成了爱情喜剧大团圆，外加殖民地人民的热烈欢迎。唯一值得称道的是几位主演的表现和美轮美奂的戏服。', '生活给了我想要的东西，同时又让我认识到那没什么意义。', '红与黑的女子版', '原著还未拜读，但电影塑造的贝姬无论如何都担不上""坏女人""三个字。这是个值得让人倾心的女子，理智聪明满腹经纶多才多艺勇敢洒脱重情重义。她是爱罗顿的，罗顿亦是，无论结果如何，他们值得彼此。', '印度的元素加得很怪。7 out of 10', 'Quite pathetic', '小乔打酱油', '初中时候看的 那时候只是因为Reese...', '基本都完美了……贝姬被抛弃的瞬间我仿佛看到了松子：女孩都梦想成为公主、白天鹅一旦走错一步就再也回不去了……P.S.杜宾先生我太心水你了~~~~', '百转千回的人生啊', 'Reese一身挚爱QAQ', '飞机上就没看过有劲的片子。', '古装剧“老三套”：女主角的贫穷、男主角的地位、一天一变的蓬蓬裙。所谓臭名昭著的女人，不过是浮华名利场的一面镜子，你说她丑恶，是因为丑恶站在她面前。', '把Jonathan Rhys-Meyers和Reese Witherspoon 这么俩人去掉我会打4星的~看98版去~~', '唔怪得甘少源，原来都唔系甘好睇', '实在讨厌Reese Witherspoon. 三颗星全给ROB的三分钟！', 'RG那时好嫩，此片萌男一堆。。', '你们这些英国 什么贵族什么的，通通去死', '剧本其实蛮不错的但翻拍的很一般。演员倒都蛮靓。威瑟斯彭古装并不太合适还是爱玛小姐漂亮男配们都很眼熟。应该看看更好版本。', '没有看过原著，电影还不错', '以前看的', '还是鼓励人们追逐名利的啊', '相比书里野心勃勃的女主，更喜欢电影里的Rebecca，她聪明，坚强，讲义气，她勇于追求爱情和自己想要的生活，她所做的一切不过是为了更好的生活。虽然对Witherspoon的颜一直都欣赏不来，但她演技真心好。此片居然还有妖男Jonathan Meyers，小惊喜了一下。', '相比与BBC版本，这个只能说还行', 'BBC版电影版哪个结尾我都不喜欢。', '果真该没有名', '一般般。。。。。。。', '浮华世界，收尾得是有些草率。', '和原著相比差的太远，演员的表演都比较到位', '部分转场很突兀', '情节连贯生硬，总之看起来很不明白为什么名利场会变成这个样子，女主角实在看起来不应该那么聪明', '华丽丽的', '小乔又只是跑龙套…讨厌', '实际上没有看到名利，看到的是男女，囧～', '终于刷了一部剧情比小乔好看的片。原著还是大学时刷的，好像不是这个结局，记得女主最终还是一个人。。。。卡司夠强大，演技都太好了。宝莱坞电影刷多了，对印度元素丝毫没有不适感，减➖⭐是色彩太秾艳了，不得不把饱和度调低一半，否则真成宝莱坞了😂', '瑞希威瑟斯彭是不适合这样大气的古装剧的，但精明世故的脸却适合贝姬。服装和场景很值得称道。', '浪费这么多好演员', '画面很漂亮', 'Reese Witherspoon，还是做回你的美国俏甜心吧。', 'd2', '好难看。。。唉。。。', '与原著相比，蓓基少了点妖媚 艾米少了点憔悴，或是两位女士少了点气场。不过觉得电影还是不错~ ps：导演是印度人吧 植入如此多印度元素。', '名利场', '电影上线那时去买了书，但没有看完，也没有去看电影。今天看了电影，嗯，嗯。 2012-12-05', '那花籃般的髮型，坑爹呢啊！']","['https://img2.doubanio.com/view/photo/m/public/p2578836203.jpg', 'https://img3.doubanio.com/view/photo/m/public/p851290820.jpg', 'https://img3.doubanio.com/view/photo/m/public/p2578836200.jpg', 'https://img1.doubanio.com/view/photo/m/public/p2516133319.jpg', 'https://img1.doubanio.com/view/photo/m/public/p2578836199.jpg']",./data1/post_video/米拉·奈尔/名利场 Vanity Fair/image,"['https://img2.doubanio.com/view/photo/sqxs/public/p729173291.jpg', 'https://img9.doubanio.com/view/photo/sqxs/public/p729173005.jpg', 'https://img9.doubanio.com/view/photo/sqxs/public/p526162104.jpg', 'https://img1.doubanio.com/view/photo/sqxs/public/p729174477.jpg', 'https://img2.doubanio.com/view/photo/sqxs/public/p729174323.jpg']",./data1/post_video/米拉·奈尔/名利场 Vanity Fair/image,[],./data1/post_video/米拉·奈尔/名利场 Vanity Fair/video
