电影名,电影网址,导演,编剧,主演,评分,评分人数,评分额外信息,类型,制片国家/地区,语言,上映时间,时长,剧情简介,获奖情况,热门评论,海报链接,海报保存路径,剧照链接,剧照保存路径,视频链接,视频保存路径
哈尔的移动城堡 ハウルの動く城,https://movie.douban.com/subject/1308807/,宫崎骏,宫崎骏/黛安娜·温恩·琼斯,"['倍赏千惠子', '木村拓哉', '美轮明宏', '我修院达也', '神木隆之介']",9.1,909549,"好于97%动画片,好于98%奇幻片",动画/奇幻/冒险,日本,日语,2004-09-05(威尼斯电影节),119分钟,继母因无力负担生活，将苏菲和她的两个妹妹都送到了制帽店去当学徒。两个妹妹很快先后就离开了制帽店去追寻各自的梦想，只有苏菲坚持了下来。一天，小镇旁边来了一座移动堡垒，传说堡垒的主人哈尔专吸取年青姑娘的灵魂，所以小镇的姑娘都不敢靠近。一个恶毒的巫婆为了报复苏菲与哈尔见面，用巫术把她变成了一个80岁的老太婆，而且苏菲还不能对别人说出自己身中的巫术。无奈，苏菲决定独自一人逃离小镇。天黑了，虚弱的苏菲没走多远，来到了移动城堡。心想自己已经是老太婆了，苏菲壮着胆子走进了城堡。不想，遇到了和她遭遇相同的火焰魔。两人约定彼此帮助对方打破各自的咒语……,"['最佳动画长片(提名)', '主竞赛单元 金狮奖 (提名)', '最佳亚洲电影(提名)']","['目前为止觉得哈尔是宫崎骏作品里最帅的男角', '宫崎骏的片子里。老奶奶都很丑。但都是好老奶奶。', '看了这个电影就想要一个家。擦地板，在阳光下面放上铺着干净桌布的餐桌，还有照顾小火苗，就如同守护爱人的心一般。（16年后update：杰作。好高兴我像16年前一样爱你）', '虽然它确实不如宫崎骏的很多作品，也不是最受欢迎的，但却是我最爱。每次响起俩人初遇时在屋顶跳跃的那段音乐，都觉得莫名的悲伤。也正是因为这种感觉，它才是最爱。', '染发剂事件之后，形象崩塌暴露屁孩本质萌到吐血！哈尔一定是宫崎骏作品最帅男主了，配音还是木 村 拓 哉，简直不给活路', '人不漂亮活着还有什么意思...哈哈哈哈太可爱了哈尔...', '你的头发染上了星光的颜色…… 爱的颜色……', '腾空徒步的那一段，最浪漫', '宫老唯一采用的美男主~~千年一见', '比起宫爷爷以前的电影,这电影的主题更轻松.但是依然有一如既往的温暖.另外,哈尔那种小屁孩的性格实在太可爱了!', '1，哈尔变身之后的造型就是折了翼的天使。2，王后是女同，看上苏菲了。3，每个宫崎骏都要有老巫婆，善良女，宠物狗，无语怪。还有各种帅男！', '看了这么多遍我还是不知道在讲什么，感觉有点野心大，又想把战争啊救赎啊什么的都说好结果就是有点没有重心。画面美爆了，也只有宫崎骏能这么有耐心吧', '爱给了苏菲勇气，哈尔爱苏菲的勇气。', '因为有爱的能力和欲望，我们才年轻。如果太自卑与屈服现实，会像苏菲一样瞬间苍老。', '这个……其实我没怎么看明白，14年的宫崎骏粉丝就这么秀逗了。……（后来千和我说她也不懂，少许有点心理安慰……）', '看过很多次，印象最深居然是里面的好吃的，煎鸡蛋和培根，还有吃鸡蛋壳的恶魔，很好看。', '行吧，那个接吻的镜头把我雷倒了。', '魔法与诅咒让互不相识的人们相遇、相识、相互保护与包容，是爱与勇气破除了禁锢的魔咒，重新回到最初的美好。故事精灵古怪，人物鲜明透彻，情节千回百转，画面色彩靓丽。', '木村拓哉的声音真是亚萨西啊……', '这是一个关于爱与拯救的故事，从最初喜欢你超高的颜值、酷炫的技能、王子一般的出场，到最后爱你内心孤独又傲娇、脆弱又勇敢、蠢萌又理想主义的小男孩。爱就是逐渐靠近、了解、懂得，接纳你真实的样子，依然不离不弃。', '欧式小镇，美少年，少女，女巫，城堡，魔法……还有比这更对胃口的了吗？', '赞这句 ""勇敢面对自己的时候是美丽的少女，退缩时就会变成风烛残年的老妇。"" 的评论', '烂片。说宫崎骏造梦还真不假，整部片就跟做梦一样混乱不堪，逻辑频繁缺失，主线变化莫测，人物表现不符情理。基本的讲故事都讲不清楚，你弄那么多山清水秀五光十色的有什么用，看美图我还不如去刷会pixiv。评分8.9的片子，排第一的评论竟然是8000多有用的剧情疑难解答，有点好笑。', '宫崎骏的作品总能够让人置身于童话中，有梦想有坚持。', '木村的哈尔~', '故事说到后面很飘忽，但还是好看的。可能要找机会再重看捋一下细节什么的...', '这部超级喜欢 百看不厌', '激动之下，把日、英、台三个配音版本全看了……', '女主为何恢复年轻这个关键点没有交代清楚、还有其他一些重要点也没有解释或逻辑不通（如为何把房子拆了建、为何躲着女法师还要留她的狗、女主妈妈怎么认出她的也没问变老原因等），可以说剧情处于半混乱状态（为了看明白还要补原著吗？）。不理解为啥同样混乱的国产片分数不超过5，这个画的好就高分。', '宫崎骏的动漫主题总是那么暖，这部电影有点反战的思想在里边。现在才知道是木村拓哉给男主角配音的，声音很好听。', '苏菲被哈尔从天上带到集市里的那段圆舞曲。我记得看这片的时候正好是月考后的家长会，我边看边焦虑得想哭。', '哈尔太帅了 看的我少女心泛滥 哈哈哈 歌曲也超级好听 我看的很表面 看完之后有想很多 但是现在都忘了差不多了 就记得哈尔好帅啊！！！！！！！！！', '其实诅咒不是衰老，而是容貌会随着心理年龄而不断变化。所以当她不敢去对抗既定命运时，当她爱上了哈尔却很自卑时她就是满脸皱纹的老妇，可当她在王宫里神采飞扬的为哈尔争辩当她牵着哈尔的手走在秘密花园，她又一点一点变回了少女。而哈尔也有对应的两面性，他是温柔俊美能保护自己心爱女子的完美情人，也是因为头发变色而大发脾气说着不漂亮还活着干嘛的幼稚小孩。 所以，他既是苏菲的儿子又是苏菲的情人。 苏菲没法直面自己的内心，哈尔也一直在逃避，他用移动的城堡来躲避战乱和国王的征召。后来他们相遇，苏菲告诉哈尔他们可以一起承担，她为他去了王宫。哈尔在敌军空袭时对苏菲说不能再逃了，他已经有了要守护的人。 从来好的感情都是为了彼此成为了更好的自己。 看这部电影的过程温柔平静，人性的美好和纯真无处不在，看完整个人都很温暖。', '哈尔是个大帅哥。', '百看不厌的一部日本动画，被小火堆萌到了(*^▽^)/★*☆', '完全想一出是一出啊，真的毫无逻辑，也没有剧本架构。为了少女心而少女心，为了反战而反战，为了飞行而飞行，为了移动城堡而移动。开头的天空舞步相当梦幻，吉卜力确实代表了日本动画的作画水平，完全是感觉的模拟重现。而神奇之处就在于，飞行这类东西，是人类不曾真实拥有过的，所以完全是梦幻的重塑和演绎。四个切换门也很精彩。后来好人坏人一锅乱炖，结尾少女之吻➕主题曲一通轰鸣解救全世界的套路，真的不能接受啊。', '爱上的是你的美丽还是你的灵魂？一般人一开始势必都接受不了丑陋且苍老的面容，但是，美丽的灵魂却可以让皮囊的普通成为至美。最后的幸福结局，就是对心灵美的最好盖章', '让心爱的人带在，在天空飞翔', '最烂的', '看过很多遍的动画了。喜欢男主角的颜，发现自己是对比较帅的动漫人物毫无抵抗力啊😂很喜欢宫崎骏的动画，很纯粹。', '觉得这感情太畸形...就火堆是最大的萌点...= =', '宫崎骏的又一经典作品，孩子很喜欢卡西法。很动人的爱情故事。', '看的第一部宫崎骏的动漫，少女心爆棚，哈尔好帅~~~', '【2】前半段不错，城堡和火焰的设定都让人欣喜；后半段乱七八糟，语焉不详，更理解不到男女主角的关系是如何建立的，女主太作，让人喜欢不起来。', '少女心扑通扑通', '我不是有意要黑这部电影，实在是因为看了好几遍之后，我还是不明白这片子讲的是什么！是部没有剧情的电影！要么有剧情，但剧情乱七八糟！这片子讲的是战争吧，好在画得很好，很单纯，让人看了心情舒畅中带着些许悲凉。宫崎骏的动画总让我想起许多儿时的纯真岁月！温馨又感动！要不是这样，我只打1分。', '一流美工，九流剧情。女主的设定为什么这么“圣母”啊，受不了。', '圣母，而且，不知所云，真不懂这种片为什么会获奖无数，成为无数老外争相追捧的电影，好电影却总被掩埋，这个世界是病了，还是我格格不入', '宫崎骏的动漫总是给人惊喜。', '宫崎骏的这部动漫是我们一个寝室围着一台电脑看得，室友从吐槽人设到花痴哈尔，总之很棒的一部动漫。从创意，色调，剧情都满满感动。']","['https://img3.doubanio.com/view/photo/m/public/p2174346180.jpg', 'https://img1.doubanio.com/view/photo/m/public/p1222295277.jpg', 'https://img9.doubanio.com/view/photo/m/public/p1222295025.jpg', 'https://img9.doubanio.com/view/photo/m/public/p1315096844.jpg', 'https://img1.doubanio.com/view/photo/m/public/p1446306899.jpg']",./data3/post_video/宫崎骏/哈尔的移动城堡 ハウルの動く城/image,"['https://img9.doubanio.com/view/photo/sqxs/public/p1057724945.jpg', 'https://img2.doubanio.com/view/photo/sqxs/public/p1057725412.jpg', 'https://img9.doubanio.com/view/photo/sqxs/public/p991884485.jpg', 'https://img2.doubanio.com/view/photo/sqxs/public/p991876962.jpg', 'https://img1.doubanio.com/view/photo/sqxs/public/p991885879.jpg']",./data3/post_video/宫崎骏/哈尔的移动城堡 ハウルの動く城/image,['https://vt1.doubanio.com/202204270921/799846e5f99c82d66b7727882f48db2f/view/movie/M/301370586.mp4'],./data3/post_video/宫崎骏/哈尔的移动城堡 ハウルの動く城/video
天空之城 天空の城ラピュタ,https://movie.douban.com/subject/1291583/,宫崎骏,宫崎骏,"['田中真弓', '横泽启子', '初井言荣', '寺田农', '常田富士男']",9.1,747037,"好于97%动画片,好于98%奇幻片",动画/奇幻/冒险,日本,日语,1992-05-01(中国大陆),125分钟,古老帝国拉比达是一座漂浮在空中的巨大的机器岛，传说那里已经无人居住，蕴藏着巨大的财富。因此，无论军方还是海盗，都在找寻着这座传说中的飞行岛。矿工帕克这天偶遇拉比达继承人希达，两人一见如故。因为希达身上有找寻拉比达帝国的重要物件飞行石，军方和海盗两帮人马都在追杀希达。帕克带着希达一起逃亡，最终都没有逃出军方的手中，希达被军队掳走了。为救朋友，帕克只能选择与海盗合作。帕克与海盗成功救出了希达，同时，他们也发现了军方的邪恶计划。为了阻止军方邪恶计划的实施，他们和海盗一起踏上了寻找拉比达之旅。,INF,"['多年后重看天空之城才能更加明白，宫崎骏对细节的处理的用心不仅仅是一时的感动你，宫崎骏能通过他的作品来让你逐渐明白生活的可贵，来明白爱与和平的作用。但就……还是早恋！', '佩服宫崎骏的想象力，电影中的某些情节还历历在目，是部非常不错的动漫电影，弦乐很动听！', '宫崎骏的一大代表作，不论是剧情，音乐，配图。节奏都非常好。看了好几遍。值得看。青涩的友情爱情，抉择。很纯情。尤其喜欢钢琴曲，不得不说。久石让与宫崎骏绝配', '我看这部一直会哭，看了几次哭了几次，也不知道为了什么。总之，一看到手臂长长的铁皮人寂寥的站在那座城中，就控制不住了。', '不看人生不圆满!!!宫爷爷的所有电影都是!', '人类历史上昙花一现的飞艇时代竟然衍生出了这么波澜壮阔的故事，尽管早期画风有点幼稚，但想象力就是让人叹为观止。我最敬佩的，是当初决定离开天空之城的先人，因为那需要太多的勇气！', '可惜1986年奥斯卡还没有最佳动画长片奖。', '配乐远比情节精彩，最后的老奶奶很温暖。', '好电影从来都不会因为岁月的流逝而失去它的味道，反而会越来越香醇，一如地窖里的酒。久石让的音乐堪称完美，画面虽是手绘，但亲切感十足，故事背景细节丰富，人物刻画生动，还有区别于一般动画的深刻主题。★★★★☆', '我愿意给10颗星！！！！！！！！！！', '还是觉得这是宫崎骏最好的一部——“我会像傻瓜那样去保护她”', '如果说自然赐予文明以生命力的话，那么贪欲则会夺取文明的生命力，直至文明毁灭。植根厚土，沐浴清风。和种子一起过冬，一起在春天里生长；和鸟儿一起在春天里歌唱；和春风一起在大地上舞动。只为追寻那最质朴的生活。“巴鲁斯”与其说他是让拉普达毁灭，还不如说是让拉普达文明涅磐重生。', '每一个女孩最后是不是都会变成妈打啊', '瑰丽的想象。', '喜欢工业革命时期笨拙又功能性的全机械化的东西，觉得发明家很了不起', '很美 无法忘记配乐', '突然好想哭……', '有时候，坚持了你最不想干的事情之后，便可得到你最想要的东西，坚持就是胜利。', '重看依旧五星，云层背后未知的神秘和美丽、繁华与凋零，就让它们永远消失，真正纯净的美只能消失，那颗孤独的树最后徜徉在无尽浩瀚，加上无比熟悉的配乐，何止感动；对飞翔的热爱，永不言败的少年和少女，充满童心的婆婆，天空某处，定有一个无人涉足、只为自己保留的小小世界。', '童年的记忆，宫崎骏的作品每一部都值得回忆，画面美，配乐也很好听！', '剧情无甚佳，但天空之城的景象忘不掉，尤其是废墟中布满杂草的死掉机器人出现的时候', '对天空的追逐，永不停止。', '久石让的原声太动人', '喜欢宫崎峻的画风，单纯舒服。这些年看过很多动画电影，玩过很多游戏，有空中城堡，有机器人，都会想到天空之城。作为90年代初期的作品，他的想象力真的丰富到难以想象。', '长长胳膊的机器人们 都有同一个灵魂吧 独守空城七百年 眼看着自己尸骸枯萎 眼看着身上蔓草丛生 眼看着呼啦啦大厦倾 眼看着她来了又走 …永远只剩下自己一个人 …想想，觉得又心酸又难过', '爱，善良，生命之树', '音乐太好了', '音乐洗涤心灵系列', '画面好看，配乐喜欢，故事也不错。一开始以为海盗是坏蛋，但是后面他们很好玩很善良。喜欢手臂长长的机器人，对希达的维护之心表现得很戳心。其实对于希达的身份还有拉普达的毁灭充满疑惑，电影里没有细说。', '男主长大后当了海贼王，去寻找拉普他的宝藏。', '不得不说日本动漫确实水平高 画面美 配乐好听 顺便再让你思索一些道理', '这是我看过的第一部宫崎骏大师的作品，也是最喜欢的一部，也许这就是初心吧。当然，那首音乐也是最爱。', '音乐满分，剧情满分。最感动我的是机器人的追捕蝴蝶的那个场景，我看到了孤单，寂寞这一些情绪然后眼泪不自觉的就落下来了', '这绝对是久石让和宫崎骏配合最完美的一次', '简单平淡的故事 主题绝非仅仅是爱情 天空之城好似一个奇幻的梦中天堂 寻找天空之城就好似寻梦 宫崎骏手执画笔为这梦勾勒出了恬静素雅的绝美 久石让以音乐则构筑了这部电影情感的洪流 优美曲调和动人心弦的美妙音律让人感动流泪', '回味经典，简单而又直白的动漫，宫崎骏在那个时代没有电脑的特效，没有高科技的设备，可能就是最初的感动吧！', '看得第一部宫崎骏电影。宫崎骏的开山之作依旧是精良且值得回味的，二十年过去，经历两个时代，二十年可以改变太多的东西。但是我还会时不时的拿出来回味，感觉还是很有继续看下去的必要，在浮躁时，落魄时，世故时，或者胡思乱想时。', '蒸汽朋克、飞行器时代、人类的飞天和超高科技的梦想… 融合在简单纯真的友谊和爱情里，真是太神奇了，可能只有宫崎骏才能做到。一棵生命之树越飘越远，去了看不见的地方，在地上的人有根基也有念想，美好呀。这主题歌好听极了，以前迷恋久石让到啥地步，日语一个字不懂却全会唱…😅', '反战真是宫崎骏热爱的主题，也正因为此，他的作品才总是笼罩着人文的关怀。', '以前没看过宫崎骏的动画（《阿丽埃蒂》不是宫崎骏导演）我是怀着膜拜大师的态度来看片的，但大失所望。精美的人设和画面、美妙的旋律下是一个充斥着俗套的漏洞百出的故事。也许我被皮克斯的真实系动画惯坏了，但我实在不喜欢这么个能让我边看边猜到下一步剧情的动画。剧情要是正常些都够主角死几百次了', '久石让音乐甚是经典。可这片拍的……也太好莱坞太斯皮尔伯格了吧！片头从飞艇坠落，在高架轨道上疯狂追逐，不正是比本片早两年的夺宝奇兵2的华彩桥段吗？而动画片在这方面存在先天缺陷，拍不出真人电影的紧张感以及微表情与小动作的幽默调剂。关键时刻项链宝石魔力四射使希达凌空安渡，算是脱离了真人冒险的逻辑维度而进入到动画该有的超想象自由王国，然后又令人遗憾地摆荡回大段类型感真实化和西方文化倾向的动作桥段，直至天空之城华丽显身才再见动画想象……如此的品质起伏跌宕自然难堪极评，更别说豆#34的耸人高位。三星半。', '心情郁闷之时看宫老的动画，轻易就能让胸中阴霾一扫而空。久石让的配乐已无需赘言，希达和巴鲁两小无猜的纯真爱情实在太过美好。人与自然、贪婪与战争、爱与牺牲的主题均得到了深入的讨论。默默守护拉比达的机器人让人由衷赞叹，对海盗一家的刻画细腻动人。人要有幻想，但还是不能离开泥土。（9.0/10）', '宫崎骏的漫画从不叫人失望，很喜欢天空之城的歌，吉他版的很忧伤，为了这首歌我还特地的买了个吉他学，没学会…吉他被我丢到角落里了，哈哈', '正因为我们是弱者 所以我们才能咬掉强者的咽喉 。 特别喜欢这句台词😃😃', '延续以往宫崎骏的风格，继续着天马行空的想象。', '有时候，坚持你最不想干的事情之后，使可得到你自己最想要的东西。', '喜欢，最喜欢的就是宫崎骏爷爷的电影 号想拥有这样一座天空之城，多美的名字，像是空中花园，也像是遗失的亚特兰蒂斯，最后有着无尽财富的城堡被毁掉了，但代表着生命的大树却留了下来，这样的结局是最好的。', '宫崎骏的动画片真好看，又满满的正能量，里面的配乐真的非常好听！', '我一定是一个不太可爱的人，才觉得这种纯爱环保题材是一个顽固的资本主义艺术家工业化创造出来的，反刍似的纯真与和平，深层的优越感让人不适——坏人那么努力追求自己的梦想凭什么就不能美梦成真呢？！；2011.02.11：很美的境、很美的音乐，很拖沓的剧情。宫崎骏是太得意自己的画跟梦境么？', '簡單的動畫中卻透露著對生命的敬畏，想象力又非凡，大師手筆']","['https://img1.doubanio.com/view/photo/m/public/p1446261379.jpg', 'https://img1.doubanio.com/view/photo/m/public/p522751329.jpg', 'https://img9.doubanio.com/view/photo/m/public/p2217294235.jpg', 'https://img9.doubanio.com/view/photo/m/public/p1446261466.jpg', 'https://img2.doubanio.com/view/photo/m/public/p740436012.jpg']",./data3/post_video/宫崎骏/天空之城 天空の城ラピュタ/image,"['https://img3.doubanio.com/view/photo/sqxs/public/p2413264020.jpg', 'https://img2.doubanio.com/view/photo/sqxs/public/p2413264031.jpg', 'https://img1.doubanio.com/view/photo/sqxs/public/p2512349027.jpg', 'https://img1.doubanio.com/view/photo/sqxs/public/p813674387.jpg', 'https://img1.doubanio.com/view/photo/sqxs/public/p454355188.jpg']",./data3/post_video/宫崎骏/天空之城 天空の城ラピュタ/image,['https://vt1.doubanio.com/202204270925/b2f4b6372d1dcb7694490d4de1d9d096/view/movie/M/301190886.mp4'],./data3/post_video/宫崎骏/天空之城 天空の城ラピュタ/video
