电影名,电影网址,导演,编剧,主演,评分,评分人数,评分额外信息,类型,制片国家/地区,语言,上映时间,时长,剧情简介,获奖情况,热门评论,海报链接,海报保存路径,剧照链接,剧照保存路径,视频链接,视频保存路径
阴阳师2 陰陽師Ⅱ,https://movie.douban.com/subject/1308379/,泷田洋二郎,泷田洋二郎/梦枕貘/江良至,"['野村万斋', '深田恭子', '中井贵一', '伊藤英明', '市原隼人']",7.7,17962,"好于75%奇幻片,好于83%动作片",动作/奇幻,日本,日语,2003-10-04(日本),112 分钟,平安时代，百鬼夜行，封鬼仪式正在右大臣藤原安麻吕府邸进行。安麻吕之女日美子（深田恭子 饰）戎装登场，一箭命中靶心，引来全场惊叹。这位被喻为“连鬼都不敢接近”的公主，却令源博雅（伊藤英明 饰）暗自倾心。天现异象，京都骚动，魍魉横行。平安京已有四人遇害，民间出现驱鬼术士幻角（中井贵一 饰），日美子亦在异象后开始梦游。博雅为此替右大臣来请安倍晴明（野村万斋 饰）商谈。与此同时，宫廷供奉的出云三神器之一草薙剑也出现了异动。晴明受天皇所托，与博雅开始调查种种异况背后出云与大和的隐秘渊源。博雅和夜弹琵琶的神秘少年须佐（市原隼人 饰）相识为乐友，须佐负伤被日美子所救，三人在右大臣府邸相逢。同一时刻，右大臣主动找到晴明，坦白了十八年前天现异象时，大和攻打出云的事实……本片为电影《阴阳师》续作。,['最佳美术指导(提名)'],"['博雅的存在，再次证明，男人只要心地善良忠厚，就算百无一用，也自有人爱。当然前提是长得要帅。', '为什么野村万斋不拍第三部第四部第五部第六部第七部第八部第九部第十部第十一部第十二部第十三部第十四部第十五部第十六部第十七部第十八部第十九部第二十部第二十一部第二十二部第二十三部第二十四部第二十五部第二十六部第二十七部第二十八部第二十九部第三十部第三十一部第三十二部第三十三部。。。', '这一集里野村的阴柔发挥到极致，而略带阳刚气的恭子和他相辅相成。中间他让恭子手臂上的大神胎记显形的片段，好浮世绘又很香艳哪！！！听野村低声呢喃咒语，真是心驰神往。我相信当时恭子的呻吟绝对发自内心。', '整部片子我就只记得源博雅那若干颗亮白闪闪的大白牙了！这家伙傻兮兮的太好玩儿了哈哈哈哈哈~~~花栗鼠啊简直……', '笑死了 晴明快收了博雅吧', '暧昧的BL。', '野村老师太美了，我很惭愧', '我就是冲着演员来的', '精彩继续', '……晴明大人，让我给你擦鞋吧……我只要守望着你和博雅的爱就好= =+', '有HAYATO', '烂是真的蛮烂的，可是能看到晴明的地方，也就只有这两部电影呀。', '稀饭！', '晴明啊 博雅啊 OOXX啊……忽视我吧', '时在天津', '阴阳师系列的人物造型做得是真的好，深田恭子的女神样简直如同画里走出来一样。这种奇幻，展现音乐，表达人与世界的关系，真是美好。', '故事和笛吹一样，与第一集相比都显得又臭又长又拖沓；鬼怪没有了诡异恐怖感；晴明也不再风流潇洒，与鬼居然是肉搏相斗，真是笑死人。。。总之是部失败的续作。', '比第一部更规整了些，且说出了妖鬼精怪片的真谛：让人间陷入水深火热的并非鬼魅，而是权贵的的贪婪和野心。 红裙白纱起舞的晴明再次惊艳，源博雅继续傻白甜。21岁的深田恭子明艳照人，导演还特意以驱邪之名设计了一段伪激情戏，色气有，但大阴阳师见人见鬼早超脱于世俗皮肉，见色不起意，辜负了鸡贼。', '當年嚇死俺咯……', '音乐不错', '又是复仇，又是复活，非常没意思的剧情。晴明换女装太妖了。', '萌这个晴明萌的挠心挠肺的', '基情没第一部那么多了，源博雅真是个可爱的小蠢货~', '非常好啊~还蛮有原著的感觉的', '素盏鸣尊的战斗力不过尔尔', '跳舞跳舞！~万斋桑万斋桑！~', '- -', '奇幻内容大缩水，沉闷台词特别多。野村万斋最后跳的那段“天宇受卖之舞”让人看得还是不舒服，导演应该遵照神话记载找个姑娘来跳脱衣舞。二星半。', '剧情上来说没有第一部给力？【一定是八百岁腐女的功劳】剧情给三星，一星加给女装晴明w', '我到現在還記得跳舞那段！！', '野村万斋~~~~~~', '万斋大师可以演范闲', '08.6.5伊藤英明好帅！！我喜欢小伊！！', '不可方物啊。。。', '狂言野村的女装扮相不错', '妖魔的浮世绘，那里的男人有着狐媚的眼神', '先看的2，伊藤很2，野村很媚，绘理子很可爱，深田恭子很华丽，弟弟演员有时候像泷泽。', '为了野村万斋！一举手一投足间风流尽显~！', '瓜南变BL男', '搞基', '越看越像一部gay片，安倍晴明和源博雅~~~~~~~', '1、2都看了，觉得都不错，只是诧异，已经挺好的两部片子为什么都要强加一段让人yy的貌似圈圈叉叉的戏呢？为了争取一点男性观众？？ 忘了说，片子本身烂，但是晴明太棒了，救了片', '我还打五星以纪念在土豆缓冲三小时看了两小时到凌晨4点才卧倒的这一天，有的电影只要有魂，情节都可以忽略的。。天，我摔进去了。。。P.S：人一修眉感觉上还真的不太一样。。。这部更妖了。。还有他和博雅之间通篇继续坦荡地调情，看的我很HIGH，囧。。', '太有意思了！', '白狐狸', '就情節來説還不如1呢,太俗套的復仇故事了吧0 0 深田恭子挺美..', '哎呀,我看的应该是这部,安倍晴明真是妩媚到不能不爱的男纸!', '是真爱吗？是真爱嘛！', '来看晴明', '最后也太暧昧了吧……']","['https://img1.doubanio.com/view/photo/m/public/p991080197.jpg', 'https://img2.doubanio.com/view/photo/m/public/p2544746772.jpg', 'https://img9.doubanio.com/view/photo/m/public/p2544699165.jpg', 'https://img1.doubanio.com/view/photo/m/public/p2168102798.jpg']",./data3/post_video/泷田洋二郎/阴阳师2 陰陽師Ⅱ/image,"['https://img2.doubanio.com/view/photo/sqxs/public/p1498969361.jpg', 'https://img2.doubanio.com/view/photo/sqxs/public/p1498969482.jpg', 'https://img9.doubanio.com/view/photo/sqxs/public/p2497807036.jpg', 'https://img2.doubanio.com/view/photo/sqxs/public/p2497807101.jpg', 'https://img9.doubanio.com/view/photo/sqxs/public/p2497807025.jpg']",./data3/post_video/泷田洋二郎/阴阳师2 陰陽師Ⅱ/image,[],./data3/post_video/泷田洋二郎/阴阳师2 陰陽師Ⅱ/video
